Work opportunity tax credit,Work opportunity tax credit,"Education, training, employment, and social services",2000-2014,2000-2016,"<p>The baseline tax system would not allow credits for particular activities, investments, or industries. Instead, it generally would seek to tax uniformly all returns from investment-like activities. In contrast, the Tax Code provides employers with a tax credit for qualified wages paid to individuals. The credit applies to employees who begin work on or before August 31, 2011 and who are certified as members of various targeted groups. The amount of the credit that can be claimed is 25 percent of qualified wages for employment less than 400 hours and 40 percent for employment of 400 hours or more. Generally, the maximum credit per employee is $2,400 and can only be claimed on the first year of wages an individual earns from an employer. However, the credit for long-term welfare recipients can be claimed on second year wages as well and has a $9,000 maximum. Employees must work at least 120 hours to be eligible for the credit. Employers must reduce their deduction for wages paid by the amount of the credit claimed. </p>"
Credit for investment in advanced energy property,Advanced Energy Property Credit,Energy,2009-2014,2010-2016,"<p>The baseline tax system would not allow credits for particular activities, investments, or industries. However, the Tax Code provides a 30 percent investment credit for property used in a qualified advanced energy manufacturing project. The Treasury Department may award up to $2.3 billion in tax credits for qualified investments. </p>"
Credits for alcohol fuels,Alcohol fuel credits   ,Energy,2000-2014,2000-2016,"<p>The baseline tax system would not allow credits for particular activities, investments, or industries. Instead, it generally would seek to tax uniformly all returns from investment-like activities. In contrast, the Tax Code provides an income tax credit for ethanol derived from renewable sources and used as fuel. In lieu of the alcohol mixture credit, the taxpayer may claim a refundable excise tax credit. In addition, small ethanol producers are eligible for a separate income tax credit for ethanol production and a separate income tax credit is available for qualified cellulosic biofuel production. </p>"
Deduction for expenditures on energy-efficient commercial building property,Allowance of deduction for certain energy efficient commercial building property,Energy,2006-2014,2005-2016,"<p>The baseline tax system would not allow deductions in addition to normal depreciation allowances for particular investments in particular industries. Instead, it generally would seek to tax uniformly all returns from investment-like activities. In contrast, the Tax Code allows a deduction, per square foot, for certain energy efficient commercial buildings. </p>"
Credit for producing fuels from a non-conventional source,Alternative fuel production credit,Energy,2000-2014,2000-2016,"<p>The baseline tax system would not allow credits for particular activities, investments, or industries. Instead, it generally would seek to tax uniformly all returns from investmentlike activities. In contrast, the Tax Code provides a credit of $3 per oil-equivalent barrel of production (in 2004 dollars) for coke or coke gas during a four-year period for qualified facilities. Under current law as of September 30, these facilities must be placed in service before January 1, 2010. </p>"
Amortization of geological and geophysical expenditures associated with oil and gas exploration,Amortize all geological and geophysical expenditures over 2 years,Energy,2006-2014,2005-2016,"<p>The baseline tax system allows taxpayers to deduct the decline in the economic value of an investment over time. However, the Tax Code allows geological and geophysical expenditures incurred in connection with oil and gas exploration in the United States to be amortized over two years for non-integrated oil companies. </p>"
Tax credits for biodiesel fuels ,Bio-Diesel and small agri-biodiesel producer tax credits   ,Energy,2006-2007,2007-2016,"<p>The baseline tax system would not allow credits for particular activities, investments, or industries. Instead, it generally would seek to tax uniformly all returns from investment-like activities. However, the Tax Code allows an income tax credit for biodiesel used or sold and for bio-diesel derived from virgin sources. In lieu of the bio-diesel credit, the taxpayer may claim a refundable excise tax credit. In addition, small agri-biodiesel producers are eligible for a separate income tax credit for ethanol production and a separate credit is available for qualified renewable diesel fuel mixtures. </p>"
New energy efficient home credit,Credit for construction of new energy efficient homes,Energy,2008-2014,2005-2016,"<p>The baseline tax system would not allow credits for particular activities, investments, or industries. Instead, it generally would seek to tax uniformly all returns from investment-like activities. However, the Tax Code allows contractors a tax credit of $2,000 for the construction of a qualified new energy-efficient home that has an annual level of heating and cooling energy consumption at least 50 percent below the annual consumption of a comparable dwelling unit. The credit equals $1,000 in the case of a new manufactured home that meets a 30 percent standard. </p>"
Credit for energy efficiency improvements to existing homes,Credit for energy efficiency improvements to existing homes,Energy,2006-2014,2005-2016,"<p>The baseline tax system would not allow credits for particular activities, investments, or industries. However, the Tax Code provides an investment tax credit for expenditures made on insulation, exterior windows, and doors that improve the energy efficiency of homes and meet certain standards. The Tax Code also provides a credit for purchases of advanced main air circulating fans, natural gas, propane, or oil furnaces or hot water boilers, and other qualified energy efficient property. </p>"
Credit for the production of energy-efficient appliances,Credit for energy efficient appliances,Energy,2006-2014,2005-2016,"<p>The baseline tax system would not allow credits for particular activities, investments, or industries. Instead, it generally would seek to tax uniformly all returns from investment-like activities. In contrast, the Tax Code provides tax credits for the manufacture of efficient dishwashers, clothes washers, and refrigerators. The size of the credit depends on the efficiency of the appliance. </p>"
Credit for holders of clean renewable energy bonds (sections 54 and 54C),Credit for holding clean renewable energy bonds ,Energy,2006-2014,2005-2016,"<p>The baseline tax system would uniformly tax all returns to investments and not allow credits for particular activities, investments, or industries. In contrast, the Tax Code provides for the issuance of Clean Renewable Energy Bonds which entitles the bond holder to a Federal income tax credit in lieu of interest. The limit on the volume issued in 2009-2010 is $2.4 billion. As of May 2010, issuers of such bonds may opt to receive direct payment with the yield becoming fully taxable. </p>"
Credits for investments in clean coal facilities,Credit for investment in clean coal facilities,Energy,2006-2014,2005-2016,"<p> The baseline tax system would uniformly tax all returns to investments and not allow credits for particular activities, investments, or industries. Instead, it generally would seek to tax uniformly all returns from investment-like activities. In contrast, the Tax Code provides investment tax credits for clean coal facilities producing electricity and for industrial gasification combined cycle projects. </p>"
Residential energy efficient property credit,Credit for residential energy efficient property,Energy,2008-2014,2005-2016,"<p>The baseline tax system would uniformly tax all returns to investments and not allow credits for particular activities, investments, or industries. However, the Tax Code provides a credit for the purchase of a qualified photovoltaic property and solar water heating property, as well as for fuel cell power plants, geothermal heat pumps and small wind property. </p>"
Eight-year inclusion from sale of electric transmission assets to independent utilities,Deferral of gain from dispositions of transmission property to implement FERC restructuring policy,Energy,2005-2008,2005-2016,"<p>The baseline tax system generally would tax gains from sale when realized. However, the Tax Code allows utilities to defer gains from the sale of their transmission assets to a FERC-approved independent transmission company. </p>"
Energy investment credit,Energy investment credit ,Energy,2006-2014,2008-2016,"<p>The baseline tax system would not allow credits for particular activities, investments, or industries. Instead, it generally would seek to tax uniformly all returns from investment-like activities. However, the Tax Code provides credits for investments in solar and geothermal energy property, qualified fuel cell power plants, stationary microturbine power plants, geothermal heat pumps, small wind property and combined heat and power property. Owners of renewable power facilities that qualify for the energy production credit may instead elect to take an energy investment credit. </p>"
Energy production credit ,Energy production credit ,Energy,2000-2014,2000-2016,"<p>The baseline tax system would not allow credits for particular activities, investments, or industries. Instead, it generally would seek to tax uniformly all returns from investment-like activities. In contrast, the Tax Code provides a credit for certain electricity produced from wind energy, biomass, geothermal energy, solar energy, small irrigation power, municipal solid waste, or qualified hydropower and sold to an unrelated party. In addition to the electricity production credit, an income tax credit is allowed for the production of refined coal and Indian coal at qualified facilities. </p>"
Credit for enhanced oil recovery costs,Enhanced oil recovery credit,Energy,2000-2014,2000-2005,"<p>A credit is provided
equal to 15 percent of the taxpayer's costs for
tertiary oil recovery on U.S. projects. Eligible costs include
the cost of constructing a gas treatment plant
to prepare Alaska natural gas for pipeline transportation
and any of the following costs with respect to
a qualified EOR project: (1) the cost of depreciable or
amortizable tangible property that is an integral part
of the project; (2) intangible drilling costs (IDCs) that
the taxpayer can elect to deduct; and (3) deductible
tertiary injectant costs. The credit rate is reduced in
taxable years following calendar years during which
the annual average unregulated wellhead price per barrel
of domestic crude oil exceeds an inflation adjusted
threshold of $28 (adjusted for inflation).</p>"
"Excess of percentage over cost depletion, fuels","Excess of percentage over cost depletion, fuels",Energy,2000-2014,2000-2016,"<p>The baseline tax system would allow recovery of the costs of developing certain oil and mineral properties using cost depletion. Cost depletion is similar in concept to depreciation, in that the costs of developing or acquiring the asset are capitalized and then gradually reduced over an estimate of the asset's productive life, as is appropriate for measuring net income. In contrast, the Tax Code generally allows independent fuel and mineral producers and royalty owners to take percentage depletion deductions rather than cost depletion on limited quantities of output. Under percentage depletion, taxpayers deduct a percentage of gross income from mineral production. In certain cases the deduction is limited to a fraction of the asset's net income. Over the life of an investment, percentage depletion deductions can exceed the cost of the investment. Consequently, percentage depletion offers more generous tax treatment than would cost depletion, which would limit deductions to an investment's cost. </p>"
Exclusion of interest on State and local government qualified private activity bonds for energy production facilities,Exclusion of interest on energy facility bonds,Energy,2000-2014,2000-2016,"<p>The baseline tax system generally would tax all income under the regular tax rate schedule. It would not allow preferentially low (or zero) tax rates to apply to certain types or sources of income. In contrast, the Tax Code allows interest earned on State and local bonds used to finance construction of certain energy facilities to be exempt from tax. These bonds are generally subject to the State private-activity-bond annual volume cap. </p>"
Exclusion of energy conservation subsidies provided by public utilities,Exclusion of utility conservation subsidies,Energy,2000-2014,2000-2016,"<p> The baseline tax system generally takes a comprehensive view of taxable income that includes a wide variety of (measurable) accretions to wealth. In certain circumstances, public utilities offer rate subsidies to non-business customers who invest in energy conservation measures. These rate subsidies are equivalent to payments from the utility to its customer, and so represent accretions to wealth, income, that would be taxable to the customer under the baseline tax system. In contrast, the Tax Code exempts these subsidies from the non-business customer's gross income. </p>"
"Expensing of exploration and development costs, fuels","Expensing of exploration and development costs, fuels",Energy,2000-2014,2000-2016,"<p>Under the baseline tax system, the costs of exploring and developing oil and gas wells would be capitalized and then amortized (or depreciated) over an estimate of the economic life of the well. This insures that the net income from the well is measured appropriately each year. In contrast to this treatment, current law allows intangible drilling costs for successful investments in domestic oil and gas wells (such as wages, the cost of using machinery for grading and drilling, and the cost of unsalvageable materials used in constructing wells) to be deducted immediately, i.e., expensed. Because it allows recovery of costs sooner, expensing is more generous for the taxpayer than would be amortization. Integrated oil companies may deduct only 70 percent of such costs and must amortize the remaining 30 percent over five years. The same rule applies to the exploration and development costs of surface stripping and the construction of shafts and tunnels for other fuel minerals. </p>"
15-year MACRS for natural gas distribution line,Natural gas distribution pipelines treated as 15-year property,Energy,2008-2014,2005-2016,"<p>The baseline tax system allows taxpayers to deduct the decline in the economic value of an investment over time. However, the Tax Code allows depreciation of natural gas distribution pipelines (placed in service between 2005 and 2011) over a 15 year period. These deductions are accelerated relative to deductions based on economic depreciation. </p>"
Incentives for small refiners to comply with EPA sulfur regulations,Pass through low sulfur diesel expensing to cooperative owners,Energy,2005-2005,2005-2005,"<p>This provision was introduced
by the Energy Tax Incentives Act of 2005. Taxpayers
may expense certain costs for investments to comply
with EPA low sulfur diesel regulations. The deduction 
may be passed-through to members of a cooperative
if the cooperative makes an election on their tax return.</p>"
Credit for holder of qualified energy conservation bonds,Qualified energy conservation bonds ,Energy,2008-2014,2008-2016,"<p>The baseline tax system would uniformly tax all returns to investments and not allow credits for particular activities, investments, or industries. However, the Tax Code provides for the issuance of energy conservation bonds which entitle the bond holder to a Federal income tax credit in lieu of interest. The limit on the volume issued in 2009-2010 is $3.2 billion. As of May 2010, issuers of such bonds may opt to receive direct payment with the yield becoming fully taxable. </p>"
Tax credit and deduction for clean-fuel burning vehicles,Tax credit and deduction for clean-fuel burning vehicles,Energy,2006-2014,2000-2016,"<p>The baseline tax system would not allow credits or deductions for particular activities, investments, or industries. Instead, it generally would seek to tax uniformly all returns from investment-like activities. In contrast, the Tax Code allows a number of credits for certain types of vehicles and property. These are available for alternative motor vehicles (including fuel cell, advanced lean burn technology, hybrid, and alternative fuel motor vehicles), alternative fuel vehicle refueling property, and plug-ins (including plug-in electric vehicles, plugin electric drive motor vehicles, and plug-in conversion kits). Under current law as of September 30, the credit expired on December 31, 2010 for non-hydrogen refueling stations. </p><p>This tax expenditure corresponds with the JCT tax expenditure ""Deduction for clean fuel vehicles and refueling property,"" found in the Transporatation Sector and available <a href="""">LINK HERE</a>..</p>"
Election to expense 50 percent of qualified property used to refine liquid fuels,Temporary 50 percent expensing for equipment used in the refining of liquid fuels,Energy,2006-2014,2005-2016,"<p>The baseline tax system allows the taxpayer to deduct the decline in the economic value of an investment over time. However, the Tax Code provides for an accelerated recovery of the cost of certain investments in refineries by allowing partial expensing of the cost, thereby giving such investments a tax advantage. </p>"
"Deduction of nonbusiness State and local government income taxes, sales taxes, and personal property taxes",Deductibility of nonbusiness State and local taxes other than on owner-occupied homes,General purpose fiscal assistance,2000-2014,2000-2016,"<p>Under the baseline tax system, a deduction for personal consumption expenditures would not be allowed. In contrast, the Tax Code allows taxpayers who itemize their deductions to claim a deduction for State and local income taxes (or, at the taxpayer's election, state and local sales taxes) and property taxes, even though these taxes primarily pay for services that, if purchased directly by taxpayers, would not be deductible. </p>"
Exclusion of interest on public purpose State and local government bonds,Exclusion of interest on public purpose State and local bonds,General purpose fiscal assistance,2000-2014,2000-2016,"<p>The baseline tax system generally would tax all income under the regular tax rate schedule. It would not allow preferentially low (or zero) tax rates to apply to certain types or sources of income. In contrast, under current law interest earned on State and local government bonds issued to finance public-purpose construction (e.g., schools, roads, sewers), equipment acquisition, and other public purposes is tax-exempt. Interest on bonds issued by Indian tribal governments for essential governmental purposes is also tax-exempt. </p>"
"Tax credit for Puerto Rico and possession income, and Puerto Rico economic activity",Tax credit for corporations receiving income from doing business in U.S. possessions,General purpose fiscal assistance,2000-2006,2000-2006,"U.S. corporations operating in a U.S. possession (e.g., Puerto Rico) can claim a credit against some or all of their U.S. tax liability on possession business income. The credit expires December 31, 2005."
Credit for increasing research activities (section 41),Credit for increasing research activities,"General science, space, and technology",2000-2014,2000-2016,"<p>The baseline tax system would uniformly tax all returns to investments and not allow credits for particular activities, investments, or industries. In contrast, the Tax Code allows an R&E credit of 20 percent of qualified research expenditures in excess of a base amount.The base amount is generally determined by multiplying a ""fixed-base percentage"" by the average amount of the company's gross receipts for the prior four years. The taxpayer's fixed base percentage generally is the ratio of its research expenses to gross receipts for 1984 through 1988. Taxpayers can elect the alternative simplified credit regime, which is equal to 14 percent (12 percent prior to 2009) of qualified research expenses that exceed 50 percent of the average qualified research expenses for the three preceding taxable years. Prior to January 1, 2009, taxpayers could also elect an alternative incremental credit regime. Under the alternative incremental credit regime the taxpayer was assigned a three-tiered fixed base percentage that is lower than the fixed-base percentage that would otherwise apply, and the credit rate was reduced. The rates for the alternative incremental credit ranged from 3 percent to 5 percent. Under current law as of September 30, the research credit expired on December 31, 2009. </p>"
Expensing of research and experimental expenditures,Expensing of research and experimentation expenditures (normal tax method),"General science, space, and technology",2000-2014,2000-2016,"<p>Research and experimentation (R&E) projects can be viewed as investments because, if successful, their benefits accrue for several years. It is often difficult, however, to identify whether a specific R&E project is successful and, if successful, what its expected life will be. Because of this ambiguity, the reference law baseline tax system would allow of expensing of R&E expenditures. In contrast, under the normal tax method, the expensing of R&E expenditures is viewed as a tax expenditure. The baseline assumed for the normal tax method is that all R&E expenditures are successful and have an expected life of five years. </p>"
Tax credit for small businesses purchasing employer insurance,Credit for employee health insurance expenses of small business ,Health,2010-2014,2010-2016,"<p>The baseline tax system would not allow credits for particular activities or targeted at specific groups. In contrast, the Tax Code provides a tax credit to qualified small employers that make a certain level of non-elective contributions towards the purchase of certain health insurance coverage for its employees. To receive a credit, an employer must have fewer than 25 full-time-equivalent employees whose average annual full-time-equivalent wages from the employer are less than $50,000 (indexed for taxable years after 2013). However, to receive a full credit, an employer must have no more than 10 full-time employees, and the average wage paid to these employees must be no more than $25,000 (indexed for taxable years after 2013). A qualifying employer may claim the credit for any taxable year beginning in 2010, 2011, 2012, and 2013 and for up to two years for insurance purchased through a Health Insurance Exchange thereafter. For taxable years beginning in 2010, 2011, 2012, and 2013, the maximum credit is 35 percent of premiums paid by qualified taxable employers and 25 percent of premiums paid by qualified tax-exempt organizations. For taxable years beginning in 2014 and later years, the maximum tax credit will increase to 50 percent of premiums paid by qualified taxable employers and 35 percent of premiums paid by qualified tax-exempt organizations. </p>"
Deduction for charitable contributions to health organizations,Deductibility of charitable contributions (health),Health,2000-2014,2000-2016,"<p>The baseline tax system would not allow a deduction for personal expenditures. In contrast, the Tax Code provides individuals and corporations a deduction for contributions to nonprofit health institutions. Tax expenditures resulting from the deductibility of contributions to other charitable institutions are listed under the education, training, employment, and social services function. </p>"
Deduction for medical expenses and long-term care expenses,Deductibility of medical expenses,Health,2000-2014,2000-2016,"<p>The baseline tax system would not allow a deduction for personal expenditures. In contrast, under current law personal expenditures for medical care (including the costs of prescription drugs) exceeding 7.5 percent of the taxpayer's adjusted gross income are deductible. For tax years beginning after 2012, only medical expenditures exceeding 10 percent of the taxpayer's adjusted gross income are deductible. However, for the years 2013, 2014, 2015 and 2016, if either the taxpayer or the taxpayer's spouse turns 65 before the end of the taxable year, the threshold remains at 7.5 percent of adjusted income. </p>"
"Exclusion of employer contributions for health care, health insurance premiums, and long-term care insurance premiums ",Exclusion of employer contributions for medical insurance premiums and medical care  ,Health,2000-2014,2000-2016,"<p>Under the baseline tax system, all compensation, including dedicated payments and in-kind benefits, should be included in taxable income. In contrast, under current law, employer-paid health insurance premiums and other medical expenses (including long-term care) are deducted as a business expense by employers, but they are not included in employee gross income. </p>"
Exclusion of interest on State and local government qualified private activity bonds for private nonprofit hospital facilities,Exclusion of interest on hospital construction bonds,Health,2000-2014,2000-2016,"<p>The baseline tax system generally would tax all income under the regular tax rate schedule. It would not allow preferentially low (or zero) tax rates to apply to certain types or sources of income. In contrast, under current law interest earned on State and local government debt issued to finance hospital construction is excluded from income subject to tax. </p>"
