JCT Title,Treasury Title(s),Budget Function,JCT Estimate Year Range,Treasury Estimate Year Range,Description
Expensing of certain capital outlays,Expensing of certain capital outlays,Agriculture,2000-2014,2000-2016,"<p>The baseline tax system requires the taxpayer to capitalize costs associated with investment property. However, farmers may expense certain expenditures for feed and fertilizer as well as for soil and water conservation measures as well as other capital improvements under current law. </p>"
Income averaging for farmers and fishermen,Income averaging for farmers,Agriculture,2000-2014,2000-2016,"<p>The baseline tax system generally taxes all earned income each year at the rate determined by the income tax. However, taxpayers may average their taxable income from farming and fishing over the previous three years. </p>"
Exclusion of cancellation of indebtedness income of farmers,Treatment of loans forgiven for solvent farmers,Agriculture,2000-2014,2000-2016,"<p>The baseline tax system requires debtors to include the amount of loan forgiveness as income or else reduce their recoverable basis in the property related to the loan. If the amount of forgiveness exceeds the basis, the excess forgiveness is taxable. However, for bankrupt debtors, the amount of loan forgiveness reduces carryover losses, unused credits, and then basis, with the remainder of the forgiven debt excluded from taxation. </p>"
Depreciation of buildings other than rental housing in excess of alternative depreciation system,Accelerated depreciation of buildings other than rental housing (normal tax method),Commerce and housing,2000-2014,2000-2016,"<p>Under an economic income tax, the costs of acquiring a building are capitalized and depreciated over time in accordance with the decline in the property's economic value due to wear and tear or obsolescence. This insures that the net income from the property is measured appropriately each year. However, the depreciation provisions of the Tax Code are part of the reference law rules, and thus do not give rise to tax expenditures under reference law. Under normal law, however, depreciation allowances reflect estimates of economic depreciation. </p>"
Depreciation of equipment in excess of the alternative depreciation system ,Accelerated depreciation of machinery and equipment (normal tax method),Commerce and housing,2000-2014,2000-2016,"<p>Under an economic income tax, the costs of acquiring machinery and equipment are capitalized and depreciated over time in accordance with the decline in the property's economic value due to wear and tear or obsolescence. This insures that the net income from the property is measured appropriately each year. However, the depreciation provisions of the Tax Code are part of the reference law rules, and thus do not give rise to tax expenditures under reference law. Under normal law, however, depreciation allowances reflect estimates of economic depreciation. </p>"
Depreciation of rental housing in excess of alternative depreciation system,Accelerated depreciation on rental housing (normal tax method),Commerce and housing,2000-2014,2000-2016,"<p>Under an economic income tax, the costs of acquiring a building are capitalized and depreciated over time in accordance with the decline in the property's economic value due to wear and tear or obsolescence. This insures that the net income from the rental property is measured appropriately each year. However, the depreciation provisions of the Tax Code are part of the reference law rules, and thus do not give rise to tax expenditures under reference law. Under normal law, however, depreciation allowances reflect estimates of economic depreciation. </p>"
Amortization of business start-up costs,Amortization of start-up costs (normal tax method),Commerce and housing,2000-2014,2000-2004,"<p>Business start-up costs are costs incurred prior to the creation of an active trade or business that would be deductible if incurred in connection with the operation of an existing trade or business. If the start-up costs were incurred on or before October 22, 2004, a taxpayer could elect to amortize them over 60 months. For costs incurred after that date, a taxpayer may elect to deduct up to $5,000 of start-up costs, but this deductible amount is reduced (but now below zero) by the amount by which the taxpayer's total start-up costs for the year exceed $50,000. Non-deducted start-up costs incurred after October 22, 2004 are amortized over a 15-year period. The normal-tax method treats the 60-month amortized amounts and the deducted amounts as tax expenditures; the reference tax method does not.</p>"
Exclusion for gain from certain small business stock,Capital gains exclusion of small corporation stock,Commerce and housing,2008-2014,2000-2016,"<p>The baseline tax system would not allow deductions and exemptions to certain types of income. In contrast, the Tax Code provides an exclusion of 50 percent (from a 28 percent tax rate) for capital gains from qualified small business stock held by individuals for more than 5 years; 75 percent for stock issued after February 17, 2009 and before September 28, 2010; and 100 percent for stock issued after September 27, 2010 and before January 1, 2011. A qualified small business is a corporation whose gross assets do not exceed $50 million as of the date of issuance of the stock. </p>"
Exclusion of capital gains on sales of principal residences,Capital gains exclusion on home sales,Commerce and housing,2000-2014,2000-2016,"<p>The baseline tax system would not allow deductions and exemptions to certain types of income. In contrast, under current law, a homeowner can exclude from tax up to $500,000 ($250,000 for singles) of the capital gains from the sale of a principal residence. The exclusion may not be used more than once every two years. </p>"
Carryover basis of capital gains on gifts,Carryover basis of capital gains on gifts,Commerce and housing,2000-2014,2000-2016,"<p> Under the baseline tax system, unrealized capital gains would be taxed when assets are transferred at death or by gift. In contrast, when a gift of appreciated asset is made under current law, the donor's basis in the transferred property (the cost that was incurred when the transferred property was first acquired) carries over to the donee. The carryover of the donor's basis allows a continued deferral of unrealized capital gains. </p>"
First-time homebuyer credit ,Credit for homebuyer,Commerce and housing,2008-2014,2008-2016,"<p>The baseline tax system would not allow credits for particular activities, investments, or industries. Instead, it generally would seek to tax uniformly all returns from investment-like activities. In contrast, the Tax Code allows a tax credit for home buyers on purchases before May 1, 2010. </p>"
Credit for low-income housing,Credit for low-income housing investments,Commerce and housing,2000-2014,2000-2016,"<p>The baseline tax system would uniformly tax all returns to investments and not allow credits for particular activities, investments, or industries. However, under current law taxpayers who invest in certain low-income housing are eligible for a tax credit. The credit rate is set so that the present value of the credit is equal to 70 percent for new construction and 30 percent for (1) housing receiving other Federal benefits (such as tax-exempt bond financing), or (2) substantially rehabilitated existing housing. The credit can exceed these levels in certain statutorily defined and State designated areas where project development costs are higher. The credit is allowed in equal amounts over 10 years and is generally subject to a volume cap. </p>"
Deduction for mortgage interest on owner-occupied residences,Deductibility of mortgage interest on owner-occupied homes,Commerce and housing,2000-2014,2000-2016,"<p>Under the baseline tax system, expenses incurred in earning income would be deductible. However, such expenses would not be deductible when the income or the return on an investment is not taxed. In contrast, the Tax Code allows an exclusion from a taxpayer's taxable income for the value of owner-occupied housing services but allows the owner-occupant to deduct mortgage interest paid on his or her primary and secondary residences as an itemized non-business deduction. In general, the mortgage interest deduction is limited to interest on debt no greater than the owner's basis in the residence, and is also limited to interest on debt of no more than $1 million. Interest on up to $100,000 of other debt secured by a lien on a principal or second residence is also deductible, irrespective of the purpose of borrowing, provided the total debt does not exceed the fair market value of the residence. As an alternative to the deduction, holders of qualified Mortgage Credit Certificates issued by State or Local governmental units or agencies may claim a tax credit of up to 20 percent of the interest expense. </p>"
Deduction for property taxes on real property,Deductibility of State and local property tax on owner-occupied homes,Commerce and housing,2000-2014,2000-2016,"<p>Under the baseline tax system, expenses incurred in earning income would be deductible. However, such expenses would not be deductible when the income or the return on an investment is not taxed. In contrast, the Tax Code allows an exclusion from a taxpayer's taxable income for the value of owner-occupied housing services but allows the owner-occupant to deduct property taxes paid on his or her primary and secondary residences. </p>"
Deduction for income attributable to domestic production activities,Deduction for US production activities,Commerce and housing,2005-2014,2004-2016,"<p>The baseline tax system generally would tax all income under the regular tax rate schedule. It would not allow preferentially low (or zero) tax rates to apply to certain types or sources of income. In contrast, the Tax Code allows for a deduction equal to a portion of taxable income attributable to domestic production. </p>"
Deferral of gain on non-dealer installment sales ,Deferral of income from installment sales,Commerce and housing,2000-2014,2000-2016,"<p>The baseline tax system generally would tax all income under the regular tax rate schedule. It would not allow preferentially low (or zero) tax rates, or deferral of tax, to apply to certain types or sources of income. Dealers in real and personal property (i.e., sellers who regularly hold property for sale or resale) cannot defer taxable income from installment sales until the receipt of the loan repayment. Nondealers (i.e., sellers of real property used in their business) are required to pay interest on deferred taxes attributable to their total installment obligations in excess of $5 million. Only properties with sales prices exceeding $150,000 are includable in the total. The payment of a market rate of interest eliminates the benefit of the tax deferral. The tax exemption for nondealers with total installment obligations of less than $5 million is, therefore, a tax expenditure. </p>"
Exclusion of income attributable to the discharge of principal residence acquisition indebtedness,Discharge of mortgage indebtedness,Commerce and housing,2008-2014,2007-2016,"<p>Under the baseline tax system, all income would generally be taxed under the regular tax rate schedule. The baseline tax system would not allow preferentially low (or zero) tax rates to apply to certain types or sources of income. In contrast, the Tax Code allows an exclusion from a taxpayer's taxable income for any discharge of indebtedness of up to $2 million from a qualified principal residence. The provision sunsets on December 31, 2012. </p>"
Exemptions from imputed interest rules,Exceptions from imputed interest rules,Commerce and housing,2000-2014,2000-2016,"<p>Holders (issuers) of debt instruments are generally required to report interest earned (paid) in the period it accrues, not when paid. In addition, the amount of interest accrued is determined by the actual price paid, not by the stated principal and interest stipulated in the instrument. In general, any debt associated with the sale of property worth less than $250,000 is excepted from the general interest accounting rules. This general $250,000 exception is not a tax expenditure under reference law but is under normal law. Exceptions above $250,000 are a tax expenditure under reference law; these exceptions include the following: (1) sales of personal residences worth more than $250,000, and (2) sales of farms and small businesses worth between $250,000 and $1 million. </p>"
Exclusion of investment income on life insurance and annuity contracts,Exclusion of interest on life insurance savings,Commerce and housing,2000-2014,2000-2016,"<p>Under the baseline tax system, individuals and corporations pay taxes on their income when it is (actually or constructively) received or accrued, depending on their method of accounting. Nevertheless, the Tax Code provides favorable tax treatment for investment income earned within qualified life insurance and annuity contracts. In general, investment income earned on qualified life insurance contracts held until death is permanently exempt from income tax. Investment income distributed prior to the death of the insured is generally tax-deferred. Investment income earned on annuities benefits from tax deferral. </p>"
Exclusion of interest on State and local government qualified private activity bonds for owner-occupied housing,Exclusion of interest on owner-occupied mortgage subsidy bonds,Commerce and housing,2000-2014,2000-2016,"<p>The baseline tax system generally would tax all income under the regular tax rate schedule. It would not allow preferentially low (or zero) tax rates to apply to certain types or sources of income. In contrast, the Tax Code allows interest earned on State and local bonds used to finance homes purchased by first-time, low-to-moderate-income buyers to be exempt. These bonds are generally subject to the State private-activity-bond annual volume cap. </p>"
Exclusion of interest on State and local government qualified private activity bonds for rental housing,Exclusion of interest on rental housing bonds,Commerce and housing,2000-2014,2000-2016,"<p>The baseline tax system generally would tax all income under the regular tax rate schedule. It would not allow preferentially low (or zero) tax rates to apply to certain types or sources of income. In contrast, the Tax Code allows interest earned on State and local government bonds used to finance multifamily rental housing projects to be tax-exempt. </p>"
Exclusion of interest on State and local government small-issue qualified private activity bonds,Exclusion of interest on small issue bonds,Commerce and housing,2000-2014,2000-2016,"<p> The baseline tax system generally would tax all income under the regular tax rate schedule. It would not allow preferentially low (or zero) tax rates to apply to certain types or sources of income. In contrast, the Tax Code allows interest earned on small issue industrial development bonds (IDBs) issued by State and local governments to finance manufacturing facilities to be tax exempt. Depreciable property financed with small issue IDBs must be depreciated, however, using the straight-line method. The annual volume of small issue IDBs is subject to the unified volume cap discussed in the mortgage housing bond section above. </p>"
Exemption of credit union income,Exemption of credit union income,Commerce and housing,2000-2014,2000-2016,"<p>Under the baseline tax system, corporations pay taxes on their profits under the regular tax rate schedule. It would not allow preferentially low (or zero) tax rates to apply to certain types or sources of income. However, in the Tax Code the earnings of credit unions not distributed to members as interest or dividends are exempt from the income tax. </p>"
Expensing under section 179 of depreciable business property,Expensing of certain small investments (normal tax method),Commerce and housing,2000-2014,2000-2016,"<p> Under the reference law baseline, the costs of acquiring tangible property and computer software would be depreciated using the Tax Code's depreciation provisions. Under the normal tax baseline, depreciation allowances are estimates of economic depreciation. However, the Tax Code allows qualifying investments by small businesses in tangible property and certain computer software to be expensed rather than depreciated over time. </p>"
"Reduced rates on first $10,000,000 of corporate taxable income",Graduated corporation income tax rate (normal tax method),Commerce and housing,2000-2014,2000-2016,"<p>Because the corporate rate schedule is part of reference tax law, it is not considered a tax expenditure under the reference method. A flat corporation income tax rate is taken as the baseline under the normal tax method; therefore the lower rate is considered a tax expenditure under this concept. </p>"
Ordinary income treatment of losses from sales of small business corporation stock,Ordinary income treatment of loss from small business corporation stock sale,Commerce and housing,2002-2002,2000-2016,"<p>The baseline tax system limits to $3,000 the write-off of losses from capital assets, with carryover of the excess to future years. In contrast, the Tax Code allows up to $100,000 in losses from the sale of small business corporate stock (capitalization less than $1 million) to be treated as ordinary losses and fully deducted. </p>"
Reduced rates of tax on dividends and long-term capital gains,"Capital gains (except agriculture, timber, iron ore, and coal), Capital gains (except agriculture, timber, iron ore, and coal), Capital gains (except agriculture, timber, iron ore, and coal), Capital gains (except agriculture, timber, iron ore, and coal), Capital gains (except agriculture, timber, iron ore, and coal), Capital gains (except agriculture, timber, iron ore, and coal), Capital gains (except agriculture, timber, iron ore, and coal), Capital gains (except agriculture, timber, iron ore, and coal), Capital gains (except agriculture, timber, iron ore, and coal), Capital gains (except agriculture, timber, iron ore, and coal), Capital gains (except agriculture, timber, iron ore, and coal), Capital gains (except agriculture, timber, iron ore, and coal), Capital gains (except agriculture, timber, iron ore, and coal), Capital gains (except agriculture, timber, iron ore, and coal), Capital gains (except agriculture, timber, iron ore, and coal), Capital gains (except agriculture, timber, iron ore, and coal), Capital gains (except agriculture, timber, iron ore, and coal), Capital gains (except agriculture, timber, iron ore, and coal), Capital gains (except agriculture, timber, iron ore, and coal), Capital gains (except agriculture, timber, iron ore, and coal), Capital gains (except agriculture, timber, iron ore, and coal), Capital gains (except agriculture, timber, iron ore, and coal), Capital gains (except agriculture, timber, iron ore, and coal), Capital gains (except agriculture, timber, iron ore, and coal), Capital gains (except agriculture, timber, iron ore, and coal), Capital gains (except agriculture, timber, iron ore, and coal), Capital gains (except agriculture, timber, iron ore, and coal), Capital gains (except agriculture, timber, iron ore, and coal), Capital gains (except agriculture, timber, iron ore, and coal), Capital gains (except agriculture, timber, iron ore, and coal), Capital gains (except agriculture, timber, iron ore, and coal), Capital gains (except agriculture, timber, iron ore, and coal), Capital gains (except agriculture, timber, iron ore, and coal), Capital gains (except agriculture, timber, iron ore, and coal), Capital gains (except agriculture, timber, iron ore, and coal), Capital gains (except agriculture, timber, iron ore, and coal), Capital gains (except agriculture, timber, iron ore, and coal), Capital gains (except agriculture, timber, iron ore, and coal), Capital gains (except agriculture, timber, iron ore, and coal), Capital gains (except agriculture, timber, iron ore, and coal), Capital gains (except agriculture, timber, iron ore, and coal), Capital gains (except agriculture, timber, iron ore, and coal), Capital gains (except agriculture, timber, iron ore, and coal), Capital gains (except agriculture, timber, iron ore, and coal), Capital gains (except agriculture, timber, iron ore, and coal), Capital gains (except agriculture, timber, iron ore, and coal), Capital gains (except agriculture, timber, iron ore, and coal), Capital gains (except agriculture, timber, iron ore, and coal), Capital gains (except agriculture, timber, iron ore, and coal), Capital gains (except agriculture, timber, iron ore, and coal), Capital gains (except agriculture, timber, iron ore, and coal), Treatment of qualified dividends, Treatment of qualified dividends, Treatment of qualified dividends, Treatment of qualified dividends, Treatment of qualified dividends, Treatment of qualified dividends, Treatment of qualified dividends, Treatment of qualified dividends, Treatment of qualified dividends, Treatment of qualified dividends, Treatment of qualified dividends, Treatment of qualified dividends, Treatment of qualified dividends, Treatment of qualified dividends, Treatment of qualified dividends, Treatment of qualified dividends, Treatment of qualified dividends, Treatment of qualified dividends, Treatment of qualified dividends, Treatment of qualified dividends, Treatment of qualified dividends, Treatment of qualified dividends, Treatment of qualified dividends, Treatment of qualified dividends, ",Commerce and housing,2000-2014,2000-2016,"<p>Capital gains (except agriculture, timber, iron ore, and coal):For individuals in 2010, tax rates on regular income vary from 10 percent to 35 percent, depending on the taxpayer's income. The baseline tax system generally would tax all income under the regular tax rate schedule. It would not allow preferentially low tax rates to apply to certain types or sources of income. In contrast, current law allows capital gains on assets held for more than one year to be taxed at a preferentially low rate that is no higher than 15 percent. </p><p>Reduced rates of tax on dividends and long-term capital gains: For individuals in 2010, tax rates on regular income vary from 10 percent to 35 percent, depending on the taxpayer's income. The baseline tax system generally would tax all income under the regular tax rate schedule. It would not allow preferentially low tax rates to apply to certain types or sources of income. In contrast, current law allows qualified dividends to be taxed at a preferentially low rate that is no higher than 15 percent. </p>"
Small life insurance company taxable income adjustment,Small life insurance company deduction,Commerce and housing,2000-2014,2000-2016,"<p> Under the baseline tax system, corporations pay taxes on their profits under the regular tax rate schedule. It would not allow preferentially low (or zero) tax rates to apply to certain types or sources of income. However, under current law small life insurance companies (with gross assets of less than $500 million) can deduct 60 percent of the first $3 million of otherwise taxable income. The deduction phases out for otherwise taxable income between $3 million and $15 million. </p>"
Tax-exempt status and election to be taxed only on investment income for certain small property and casualty insurance companies,Special alternative tax on small property and casualty insurance companies,Commerce and housing,2007-2014,2000-2016,"<p>Under the baseline tax system, corporations pay taxes on their profits under the regular tax rate schedule. It would not allow preferentially low (or zero) tax rates to apply to certain types or sources of income. Under current law, however, stock non-life insurance companies are generally exempt from tax if their gross receipts for the taxable year do not exceed $600,000 and more than 50 percent of such gross receipts consists of premiums. Mutual non-life insurance companies are generally tax-exempt if their annual gross receipts do not exceed $150,000 and more than 35 percent of gross receipts consist of premiums. Also, non-life insurance companies with no more than $1.2 million of annual net premiums may elect to pay tax only on their taxable investment income. </p>"
Deduction for certain film and television production costs,Special rules for certain film and TV production,Commerce and housing,2005-2009,2004-2016,"<p>The baseline tax system generally would tax all income under the regular tax rate schedule. It would not allow preferentially low (or zero) tax rates to apply to certain types or sources of income. In contrast, under current law taxpayers may deduct up to $15 million per production ($20 million in certain distressed areas) in non-capital expenditures incurred during the year. Under current law as of September 30, the provision expired on December 31, 2009. </p>"
Exclusion of capital gains at death,Step-up basis of capital gains at death,Commerce and housing,2000-2014,2000-2016,"<p> Under the baseline tax system, unrealized capital gains would be taxed when assets are transferred at death or by gift. In contrast, capital gains on assets held at the owner's death are not subject to capital gains tax under current law. The cost basis of the appreciated assets is adjusted to the market value at the owner's date of death. </p>"
