Empowerment zones and renewal communities,Empowerment zones and renewal communities,Community and regional development,2000-2014,2000-2016,"<p>The baseline tax system generally would tax all income under the regular tax rate schedule. It would not allow preferentially low (or zero) tax rates to apply to certain types or sources of income, tax credits, and writeoffs faster than economic depreciation. In contrast, under current law qualifying businesses in designated economically depressed areas can receive tax benefits such as an employer wage credit, increased expensing of investment in equipment, special tax-exempt financing, accelerated depreciation, and certain capital gains incentives. </p>"
"Exclusion of interest on State and local government qualified private activity bonds for private airports, docks, and mass-commuting facilities","Exclusion of interest for airport, dock, and similar bonds",Community and regional development,2000-2009,2000-2016,"<p> The baseline tax system generally would tax all income under the regular tax rate schedule. It would not allow preferentially low (or zero) tax rates to apply to certain types or sources of income. In contrast, the Tax Code allows interest earned on State and local bonds issued to finance high-speed rail facilities and Government-owned airports, docks, wharves, and sport and convention facilities to be tax-exempt. These bonds are not subject to a volume cap. </p>"
"Expensing of environmental remediation costs (""Brownfields'')",Expensing of environmental remediation costs,Community and regional development,2000-2008,2000-2016,"<p>Under the baseline tax system, the costs would be amortized (or depreciated) over an estimate of the economic life of the building. This insures that the net income from the buildings is measured appropriately each year. However, the Tax Code allows taxpayers who clean up certain hazardous substances at a qualified site to expense the clean-up costs, even though the expenses will generally increase the value of the property significantly or appreciably prolong the life of the property. </p>"
"Tax credit for rehabilitation of structures, other than historic structures",Investment credit for rehabilitation of structures (other than historic),Community and regional development,2000-2005,2000-2016,"<p>The baseline tax system would uniformly tax all returns to investments and not allow credits for particular activities, investments, or industries. However, the Tax Code allows a 10-percent investment tax credit for the rehabilitation of buildings that are used for business or productive activities and that were erected before 1936 for other than residential purposes. The taxpayer's recoverable basis must be reduced by the amount of the credit. </p><p>This tax expenditure corresponds with the JCT tax expenditure ""Credit for rehabilitation of structures, other than historic structures,"" found in the Commerce and Housing Budget Function and available <a href=""/tax_expenditures/db/group/90/?estimate=3&year=2001"">LINK HERE</a>.</p>"
New markets tax credit,New markets tax credit,Community and regional development,2001-2014,2000-2016,"<p>The baseline tax system would not allow credits for particular activities, investments, or industries. However, under current law taxpayers who make qualified equity investments in a community development entity (CDE), which then makes qualified investments in low-income communities, are eligible for a tax credit received over 7 years. The total equity investment available for the credit across all CDEs is $5 billion in 2009. Under current law as of September 30, the credit expired on December 31, 2009. </p>"
Issuance of recovery zone economic development bonds,Recovery Zone Bonds ,Community and regional development,2009-2014,2009-2016,"<p>The baseline tax system would not allow credits for particular activities, investments, or industries. In addition, it would tax all income under the regular tax rate schedule. It would not allow preferentially low (or zero) tax rates to apply to certain types or sources of income. In contrast, the Tax Code allows local governments to issue up $10 billion in taxable Recovery Zone Economic Development Bonds in 2009 and 2010 and receive a direct payment from Treasury equal to 45 percent of interest expenses. In addition, they would be allowed to allocate up to $15 billion in tax exempt Recovery Zone Facility Bonds. These bonds finance certain kinds of business development in areas of economic distress. </p>"
Issuance of tribal economic development bonds,Tribal Economic Development Bonds,Community and regional development,2009-2014,2009-2016,"<p>The baseline tax system generally would tax all income under the regular tax rate schedule. It would not allow preferentially low (or zero) tax rates to apply to certain types or sources of income. In contrast, the Tax Code was modified in 2009 to allow Indian tribal governments to issue tax exempt ""tribal economic development bonds."" There is a national bond limitation of $2 billion. </p>"
Adoption credit and employee adoption benefits exclusion,Adoption credit and exclusion ,"Education, training, employment, and social services",2000-2014,2000-2016,"<p>The baseline tax system would not allow credits for particular activities. Instead, taxpayers can receive a refundable tax credit for qualified adoption expenses under current law. The maximum credit is $13,170 per child for 2010, and is phased-out ratably for taxpayers with modified AGI between $182,520 and $222,520. The credit amounts and the phase-out thresholds are indexed for inflation. Taxpayers may also exclude qualified adoption expenses from income, subject to the same maximum amounts and phase-out as the credit. The same expenses cannot qualify for tax benefits under both programs; however, a taxpayer may use the benefits of the exclusion and the tax credit for different expenses. </p>"
Credit for children under age 17 ,Child credit ,"Education, training, employment, and social services",2000-2014,2000-2016,"<p>The baseline tax system would not allow credits for particular activities or targeted at specific groups. Under current law, however, taxpayers with children under age 17 can qualify for a $1,000 partially refundable per child credit. The maximum credit declines to $500 in 2011 and later years. The credit is phased out for taxpayers at the rate of $50 per $1,000 of modified AGI above $110,000 ($75,000 for singles). </p>"
Tax credit for child and dependent care expenses,Credit for child and dependent care expenses,"Education, training, employment, and social services",2000-2005,2000-2016,"<p>The baseline tax system would not allow credits for particular activities or targeted at specific groups. In contrast, the Tax Code provides married couples with child and dependent care expenses a tax credit when one spouse works full time and the other works at least part time or goes to school. The credit may also be claimed by single parents and by divorced or separated parents who have custody of children. In 2010, expenditures up to a maximum $3,000 for one dependent and $6,000 for two or more dependents are eligible for the credit. The credit is equal to 35 percent of qualified expenditures for taxpayers with incomes of $15,000. The credit is reduced to a minimum of 20 percent by one percentage point for each $2,000 of income in excess of $15,000. </p><p>This tax expenditure corresponds with the Treasury tax expenditure ""Credit for child and dependent care and exclusion of employer-provided child care,"" found in the Education, Training, Employment, and Social Services Budget Function and available <a href="""">LINK HERE</a>.</p>"
Credit for disabled access expenditures,Credit for disabled access expenditures,"Education, training, employment, and social services",2000-2014,2000-2016,"<p>The baseline tax system would not allow credits for particular activities, investments, or industries. In contrast, the Tax Code provides small businesses (less than $1 million in gross receipts or fewer than 31 full-time employees) a 50-percent credit for expenditures in excess of $250 to remove access barriers for disabled persons. The credit is limited to $5,000. </p>"
Credit for holders of qualified zone academy bonds,Credit for holders of zone academy bonds ,"Education, training, employment, and social services",2000-2014,2000-2016,"<p> The baseline tax system would not allow credits for particular activities, investments, or industries. Under current law, however, financial institutions that own zone academy bonds receive a non-refundable tax credit rather than interest. The credit is included in gross income. Proceeds from zone academy bonds may only be used to renovate, but not construct, qualifying schools and for certain other school purposes. Under current law as of September 30, the total amount of zone academy bonds that may be issued is limited to $1.4 billion in 2009 and 2010. </p>"
Deduction for charitable contributions to educational institutions,Deductibility of charitable contributions (education),"Education, training, employment, and social services",2000-2014,2000-2016,"<p>The baseline tax system would not allow a deduction for personal expenditures. In contrast, the Tax Code provides taxpayers a deduction for contributions to nonprofit educational institutions. Moreover, taxpayers who donate capital assets to educational institutions can deduct the asset's current value without being taxed on any appreciation in value. An individual's total charitable contribution generally may not exceed 50 percent of adjusted gross income; a corporation's total charitable contributions generally may not exceed 10 percent of pre-tax income. </p>"
"Deduction for charitable contributions, other than for education and health ","Deductibility of charitable contributions, other than education and health","Education, training, employment, and social services",2000-2014,2000-2016,"<p>The baseline tax system would not allow a deduction for personal expenditures. In contrast, the Tax Code provides taxpayers a deduction for contributions to charitable, religious, and certain other nonprofit organizations. Taxpayers who donate capital assets to charitable organizations can deduct the assets' current value without being taxed on any appreciation in value. An individual's total charitable contribution generally may not exceed 50 percent of adjusted gross income; a corporation's total charitable contributions generally may not exceed 10 percent of pre-tax income. </p>"
Deduction for interest on student loans,Deductibility of student-loan interest,"Education, training, employment, and social services",2000-2014,2000-2016,"<p>The baseline tax system accepts current law's general rule limiting taxpayers' ability to deduct non-business interest expenses. In contrast, taxpayers may claim an above-the-line deduction of up to $2,500 on interest paid on an education loan. Interest may only be deducted for the first five years in which interest payments are required. In 2010, the maximum deduction is phased down ratably for taxpayers with modified AGI between $120,000 and $150,000 ($60,000 and $75,000 for singles), indexed. </p>"
Deduction for higher education expenses,Deduction for higher education expenses,"Education, training, employment, and social services",2002-2014,2001-2016,"<p> The baseline tax system would not allow a deduction for personal expenditures. In contrast, the Tax Code provides a maximum annual deduction of $4,000 in 2010 for qualified higher education expenses for taxpayers with adjusted gross income up to $130,000 on a joint return ($65,000 for singles). Taxpayers with adjusted gross income up to $160,000 on a joint return ($80,000 for singles) may deduct up to $2,000. </p>"
Exclusion of income attributable to the discharge of certain student loan debt and NHSC and certain state educational loan repayments,Discharge of student loan indebtedness,"Education, training, employment, and social services",2005-2014,2004-2016,"<p> Under the baseline tax system, all compensation, including dedicated payments and in-kind benefits, should be included in taxable income. In contrast, the Tax Code allows certain professionals who perform in underserved areas or specific fields, and as a consequence have their student loans discharged, not to recognize such discharge as income. </p>"
Exclusion of earnings of Coverdell education savings accounts,Education Individual Retirement Accounts,"Education, training, employment, and social services",2000-2014,2000-2016,"<p>The baseline tax system generally would tax all income under the regular tax rate schedule. It would not allow preferentially low (or zero) tax rates to apply to certain types or sources of income. Contributions to an education IRA are not tax-deductible. However, investment income earned by education IRAs is not taxed when earned, and investment income from an education IRA is tax-exempt when withdrawn to pay for a student's education expenses. The maximum contribution to an education IRA in 2010 is $2,000 per beneficiary. The maximum contribution is phased down ratably for taxpayers with modified AGI between $190,000 and $220,000 ($95,000 and $110,000 for singles). </p>"
Exclusion of employer-provided child care,Employer provided child care exclusion,"Education, training, employment, and social services",2000-2005,2000-2016,"<p> Under the baseline tax system, all compensation, including dedicated payments and in-kind benefits, should be included in taxable income. In contrast, under current law up to $5,000 of employer-provided child care is excluded from an employee's gross income even though the employer's costs for the child care are a deductible business expense. </p><p>This tax expenditure corresponds with the Treasury tax expenditure ""Credit for child and dependent care and exclusion of employer-provided child care,"" found in the Education, Training, Employment, and Social Services Budget Function and available <a href="""">LINK HERE</a>.</p>"
Credit for employer-provided dependent care,Employer-provided child care credit,"Education, training, employment, and social services",2002-2014,2001-2016,"<p>The baseline tax system would not allow credits for particular activities, investments, or industries. Instead, current law provides a credit equal to 25 percent of qualified expenses for employee child care and 10 percent of qualified expenses for child care resource and referral services. Employer deductions for such expenses are reduced by the amount of the credit. The maximum total credit is limited to $150,000 per taxable year. </p>"
Exclusion of certain foster care payments,Exclusion of certain foster care payments,"Education, training, employment, and social services",2000-2014,2000-2016,"<p>The baseline tax system generally would tax all income under the regular tax rate schedule. It would not allow preferentially low (or zero) tax rates to apply to certain types or sources of income. Foster parents provide a home and care for children who are wards of the State, under contract with the State. However, compensation received for this service is excluded from the gross incomes of foster parents; the expenses they incur are nondeductible. </p>"
Exclusion of employee meals and lodging (other than military),Exclusion of employee meals and lodging (other than military),"Education, training, employment, and social services",2000-2014,2000-2016,"<p> Under the baseline tax system, all compensation, including dedicated payments and in-kind benefits, should be included in taxable income. In contrast, under current law employer-provided meals and lodging are excluded from an employee's gross income even though the employer's costs for these items are a deductible business expense. </p>"
Exclusion of employer-provided educational assistance,Exclusion of employer-provided educational assistance,"Education, training, employment, and social services",2000-2014,2000-2016,"<p> Under the baseline tax system, all compensation, including dedicated payments and in-kind benefits, should be included in taxable income because they represent accretions to wealth that do not materially differ from cash wages. Under current law, however, employer-provided educational assistance is excluded from an employee's gross income even though the employer's costs for this assistance are a deductible business expense. </p>"
Exclusion of interest on State and local government qualified private activity bonds for private nonprofit and qualified public educational facilities,Exclusion of interest on bonds for private nonprofit educational facilities,"Education, training, employment, and social services",2000-2014,2000-2016,"<p>The baseline tax system generally would tax all income under the regular tax rate schedule. It would not allow preferentially low (or zero) tax rates to apply to certain types or sources of income. In contrast, under current law interest earned on State and local Government bonds issued to finance the construction of facilities used by private nonprofit educational institutions is not taxed. </p>"
Exclusion of interest on educational savings bonds,Exclusion of interest on savings bonds redeemed to finance educational expenses,"Education, training, employment, and social services",2000-2014,2000-2016,"<p>The baseline tax system generally would tax all income under the regular tax rate schedule. It would not allow preferentially low (or zero) tax rates to apply to certain types or sources of income. Under current law, however, interest earned on U.S. savings bonds issued after December 31, 1989 is tax-exempt if the bonds are transferred to an educational institution to pay for educational expenses. The tax exemption is phased out for taxpayers with AGI between $105,100 and $135,100 ($70,100 and $85,100 for singles) in 2010. </p>"
Exclusion of interest on State and local government qualified private activity bonds for student loans,Exclusion of interest on student-loan bonds,"Education, training, employment, and social services",2000-2014,2000-2016,"<p>The baseline tax system generally would tax all income under the regular tax rate schedule. It would not allow preferentially low (or zero) tax rates to apply to certain types or sources of income. In contrast, interest earned on State and local bonds issued to finance student loans is tax-exempt under current law. The volume of all such private activity bonds that each State may issue annually is limited. </p>"
Exclusion of housing allowances for ministers,Exclusion of parsonage allowances,"Education, training, employment, and social services",2000-2014,2000-2016,"<p>Under the baseline tax system, all compensation, including dedicated payments and in-kind benefits, would be included in taxable income. Dedicated payments and in-kind benefits represent accretions to wealth that do not differ materially from cash wages. In contrast, the Tax Code allows an exclusion from a clergyman's taxable income for the value of the clergyman's housing allowance or the rental value of the clergyman's parsonage. </p>"
Exclusion of scholarship and fellowship income,Exclusion of scholarship and fellowship income (normal tax method),"Education, training, employment, and social services",2000-2014,2000-2016,"<p> Scholarships and fellowships are excluded from taxable income to the extent they pay for tuition and course-related expenses of the grantee. Similarly, tuition reductions for employees of educational institutions and their families are not included in taxable income. From an economic point of view, scholarships and fellowships are either gifts not conditioned on the performance of services, or they are rebates of educational costs. Thus, under the baseline tax system of the reference law method, this exclusion is not a tax expenditure because this method does not include either gifts or price reductions in a taxpayer's gross income. The exclusion, however, is considered a tax expenditure under the normal tax method, which includes gift-like transfers of Government funds in gross income (many scholarships are derived directly or indirectly from Government funding). </p>"
Hope credit ,HOPE tax credit,"Education, training, employment, and social services",2008-2014,2000-2016,"<p>The baseline tax system would not allow credits for particular activities, investments, or industries. Under current law, however, the non-refundable HOPE tax credit allows a credit for 100 percent of an eligible student's first $1,200 of tuition and fees and 50 percent of the next $1,200 of tuition and fees. The credit only covers tuition and fees paid during the first two years of a student's post-secondary education. In 2010, the credit is phased out ratably for taxpayers with modified AGI between $100,000 and $120,000 ($50,000 and $60,000 for singles), indexed. </p><p>This tax expenditure corresponds with the Treasury tax expenditure ""Tax credits for tuition for post-secondary education,"" found in the Education, Training, Employment, and Social Services Budget Function and available <a href="""">LINK HERE</a>.</p>"
Lifetime learning credit,Lifetime Learning tax credit,"Education, training, employment, and social services",2008-2014,2000-2016,"<p>The baseline tax system would not allow credits for particular activities, investments, or industries. Under current law, however, the non-refundable Lifetime Learning tax credit allows a credit for 20 percent of an eligible student's tuition and fees, up to a maximum credit per return of $2,000. The credit is phased out ratably for taxpayers with modified AGI between $100,000 and $120,000 ($50,000 and $60,000 for singles), indexed. The credit applies to both undergraduate and graduate students. </p><p>This tax expenditure corresponds with the Treasury tax expenditure ""Tax credits for tuition for post-secondary education,"" found in the Education, Training, Employment, and Social Services Budget Function and available <a href="""">LINK HERE</a>.</p>"
Parental personal exemption for students aged 19 to 23,Parental personal exemption for students age 19 or over,"Education, training, employment, and social services",2000-2014,2000-2016,"<p>Under the baseline tax system, a personal exemption for the taxpayer is allowed. However, additional exemptions for targeted groups within a given filing status would not be allowed. In contrast, the Tax Code allows taxpayers to claim personal exemptions for dependent children who are over the age of 18 or under the age of 24 and who (1) reside with the taxpayer for over half the year (with exceptions for temporary absences from home, such as for school attendance), (2) are full-time students, and (3) do not claim a personal exemption on their own tax returns. </p>"
Qualified school construction bonds,Qualified school construction bonds ,"Education, training, employment, and social services",2009-2014,2009-2016,"<p>The baseline tax system would not allow credits for particular activities, investments, or industries. Instead, it generally would seek to tax uniformly all returns from investment-like activities. In contrast, the Tax Code was modified in 2009 to provide a tax credit in lieu of interest to holders of qualified school construction bonds. The national volume limit is $22 billion over 2009 and 2010. As of May 2010, issuers of such bonds may opt to receive direct payment with the yield becoming fully taxable. </p>"
Deduction for teacher classroom expenses,Special deduction for teacher expenses,"Education, training, employment, and social services",2003-2014,2003-2016,"<p>The baseline tax system would not allow a deduction for personal expenditures. In contrast, under current law educators in both public and private elementary and secondary schools, who work at least 900 hours during a school year as a teacher, instructor, counselor, principal or aide, may subtract up to $250 of qualified expenses when figuring their adjusted gross income (AGI). This provision expired on December 31, 2009. </p>"
Prepaid tuition programs,State prepaid tuition plans,"Education, training, employment, and social services",2008-2014,2000-2016,"<p>The baseline tax system generally would tax all income under the regular tax rate schedule. It would not allow preferentially low (or zero) tax rates to apply to certain types or sources of income. Some States have adopted prepaid tuition plans and prepaid room and board plans, which allow persons to pay in advance for college expenses for designated beneficiaries. Under current law, investment income, or the return on prepayments, is not taxed when earned, and is tax-exempt when withdrawn to pay for qualified expenses. </p><p>This tax expenditure corresponds with the JCT tax expenditure ""Exclusion of tax earnings of qualified tuition programs,"" found in the Education, Training, Employment, and Social Services Budget Function and available <a href="""">LINK HERE</a>.</p>"
Welfare-to-work tax credit,Welfare-to-work tax credit,"Education, training, employment, and social services",2000-2006,2000-2016,"<p>The baseline tax system would not allow credits for particular activities, investments, or industries. Instead, it generally would seek to tax uniformly all returns from investment-like activities. In contrast, under current law an employer is eligible for a tax credit on the first $20,000 of eligible wages paid to qualified long-term family assistance recipients during the first two years of employment. The welfare-to-work credit expired on December 31, 2006. After this date, long-term welfare recipients became a WOTC target group. </p>"
