#,Program Title,Agency/Office,Types of Assistance,Date Modified,Date Published
93.135,Centers for Research and Demonstration for Health Promotion and Disease Prevention,Department of Health and Human Services / Centers for Disease Control and Prevention,B - Cooperative Agreements,9/22/2010 7:29,1/1/1990 0:00
93.136,Injury Prevention and Control Research and State and Community Based Programs,Department of Health and Human Services / Centers for Disease Control and Prevention,B - PROJECT GRANTS,7/16/2010 8:08,1/1/1990 0:00
93.137,Community Programs to Improve  Minority Health Grant Program,Department of Health and Human Services / Office of Minority Health,B - PROJECT GRANTS,9/29/2010 7:56,1/1/1990 0:00
93.138,Protection and Advocacy for Individuals with Mental Illness,Department of Health and Human Services / Substance Abuse and Mental Health Services Administration,A - FORMULA GRANTS,8/9/2010 8:15,1/1/1990 0:00
93.140,Intramural Research Training Award,Department of Health and Human Services / National Institutes of Health,B - PROJECT GRANTS,10/1/2010 8:22,1/1/1990 0:00
93.142,NIEHS Hazardous Waste Worker Health and Safety Training,Department of Health and Human Services / National Institutes of Health,B - Project Grants (Cooperative Agreements),8/24/2010 7:31,1/1/1990 0:00
93.143,NIEHS Superfund Hazardous Substances_Basic Research and Education,Department of Health and Human Services / National Institutes of Health,B - PROJECT GRANTS,7/6/2010 11:14,1/1/1990 0:00
93.145,AIDS Education and Training Centers,Department of Health and Human Services / Health Resources and Services Administration,B - PROJECT GRANTS,9/16/2010 11:08,1/1/1990 0:00
93.150,Projects for Assistance in Transition from Homelessness (PATH),Department of Health and Human Services / Substance Abuse and Mental Health Services Administration,A - FORMULA GRANTS,8/10/2010 7:46,1/1/1990 0:00
93.153,"Coordinated Services and Access to Research for Women, Infants, Children, and Youth",Department of Health and Human Services / Health Resources and Services Administration,B - PROJECT GRANTS,7/12/2010 8:35,1/1/1990 0:00
93.155,Rural Health Research Centers,Department of Health and Human Services / Health Resources and Services Administration,B - PROJECT GRANTS,9/16/2010 11:09,1/1/1990 0:00
93.156,"Geriatric Training for Physicians, Dentists and Behavioral/Mental Health Professionals",Department of Health and Human Services / Health Resources and Services Administration,"B - PROJECT GRANTS, M - Training",7/2/2010 10:16,1/1/1990 0:00
93.157,Centers of Excellence,Department of Health and Human Services / Health Resources and Services Administration,"A - Formula Grants, B - PROJECT GRANTS",7/2/2010 10:16,1/1/1990 0:00
93.161,Health Program for Toxic Substances and Disease Registry,Department of Health and Human Services / Agency for Toxic Substances and Disease Registry,B - PROJECT GRANTS,7/16/2010 8:08,1/1/1990 0:00
93.162,National Health Service Corps Loan Repayment Program,Department of Health and Human Services / Health Resources and Services Administration,C - DIRECT PAYMENTS FOR A SPECIFIED USE,7/2/2010 10:16,1/1/1990 0:00
93.164,Indian Health Service Educational Loan Repayment,Department of Health and Human Services / Indian Health Service,C - Direct Payments for Specified Use,9/21/2010 14:06,1/1/1990 0:00
93.165,Grants to States for Loan Repayment Program,Department of Health and Human Services / Health Resources and Services Administration,"B - PROJECT GRANTS, C - Direct Payments for Specified Use",7/2/2010 10:17,1/1/1990 0:00
93.172,Human Genome Research,Department of Health and Human Services / National Institutes of Health,B - PROJECT GRANTS,7/19/2010 11:37,1/1/1990 0:00
93.173,Research Related to Deafness and Communication Disorders,Department of Health and Human Services / National Institutes of Health,B - PROJECT GRANTS,7/8/2010 7:49,1/1/1990 0:00
93.178,Nursing Workforce Diversity,Department of Health and Human Services / Health Resources and Services Administration,B - PROJECT GRANTS,7/2/2010 10:17,1/1/1990 0:00
93.184,Disabilities Prevention,Department of Health and Human Services / Centers for Disease Control and Prevention,B - Cooperative Agreements,7/16/2010 8:08,1/1/1990 0:00
93.185,"Immunization Research, Demonstration, Public Information and Education_Training and Clinical Skills Improvement Projects",Department of Health and Human Services / Centers for Disease Control and Prevention,B - PROJECT GRANTS,7/28/2010 7:51,1/1/1990 0:00
93.186,National Research Service Award in Primary Care Medicine,Department of Health and Human Services / Health Resources and Services Administration,M - TRAINING,9/16/2010 11:09,1/1/1990 0:00
93.187,Undergraduate Scholarship Program for Individuals from Disadvantaged Backgrounds,Department of Health and Human Services / National Institutes of Health,B - PROJECT GRANTS,7/8/2010 10:25,1/1/1995 0:00
93.189,Health Education Training Centers Continuing Educational Support for Health Professionals Serving in Underserved Communities,Department of Health and Human Services / Health Resources and Services Administration,B - PROJECT GRANTS,7/2/2010 10:17,1/1/1990 0:00
93.191,Patient Navigator and Chronic Disease Prevention Program,Department of Health and Human Services / Health Resources and Services Administration,B - PROJECT GRANTS,7/1/2010 15:12,1/1/1990 0:00
93.193,Urban Indian Health Services,Department of Health and Human Services / Indian Health Service,B - PROJECT GRANTS,9/21/2010 14:06,1/1/1990 0:00
93.197,Childhood Lead Poisoning Prevention Projects_State and Local Childhood Lead Poisoning Prevention and Surveillance of Blood Lead Levels in Children,Department of Health and Human Services / Centers for Disease Control and Prevention,B - PROJECT GRANTS,7/16/2010 8:09,1/1/1990 0:00
93.204,Surveillance of Hazardous Substance Emergency Events,Department of Health and Human Services / Agency for Toxic Substances and Disease Registry,B - PROJECT GRANTS,7/15/2010 7:42,1/1/1994 0:00
93.206,Human Health Studies_Applied Research and Development,Department of Health and Human Services / Agency for Toxic Substances and Disease Registry,B - PROJECT GRANTS,10/1/2010 8:22,1/1/1994 0:00
93.209,Contraception and Infertility Research Loan Repayment Program,Department of Health and Human Services / National Institutes of Health,C - DIRECT PAYMENTS FOR A SPECIFIED USE,7/15/2010 11:27,1/1/1995 0:00
93.210,Tribal Self-Governance Program: IHS Compacts/Funding Agreements,Department of Health and Human Services / Indian Health Service,C - Direct Payments for Specified Use,7/8/2010 7:51,1/1/1994 0:00
93.211,Telehealth Programs,Department of Health and Human Services / Health Resources and Services Administration,B - PROJECT GRANTS,9/16/2010 11:09,1/1/1994 0:00
93.212,Chiropractic Demonstration Project Grants,Department of Health and Human Services / Health Resources and Services Administration,B - PROJECT GRANTS,7/1/2010 15:13,1/1/1994 0:00
93.213,Research and Training in Complementary and Alternative Medicine,Department of Health and Human Services / National Institutes of Health,"B - PROJECT GRANTS, M - TRAINING",6/29/2010 7:57,1/1/1994 0:00
93.217,Family Planning_Services,Department of Health and Human Services / Office of Population Affairs,B - PROJECT GRANTS,9/29/2010 7:57,1/1/1990 0:00
93.220,Clinical Research Loan Repayment Program for Individuals from Disadvantaged Backgrounds,Department of Health and Human Services / National Institutes of Health,B - PROJECT GRANTS,7/9/2010 11:28,1/1/1994 0:00
93.223,Development and Coordination of Rural Health Services,Department of Health and Human Services / Health Resources and Services Administration,B - PROJECT GRANTS,7/9/2010 8:11,1/1/1994 0:00
93.224,"Consolidated Health Centers (Community Health Centers, Migrant Health Centers, Health Care for the Homeless, Public Housing Primary Care, and School Based Health Centers)",Department of Health and Human Services / Health Resources and Services Administration,B - PROJECT GRANTS,9/16/2010 11:10,1/1/1990 0:00
93.225,National Research Service Awards_Health Services Research Training,Department of Health and Human Services / Agency for Healthcare Research and Quality,B - PROJECT GRANTS,7/12/2010 7:29,1/1/1990 0:00
93.226,"Research on Healthcare Costs, Quality and Outcomes",Department of Health and Human Services / Agency for Healthcare Research and Quality,B - PROJECT GRANTS,7/12/2010 7:43,1/1/1990 0:00
93.228,Indian Health Service_Health Management Development Program,Department of Health and Human Services / Indian Health Service,B - PROJECT GRANTS,7/8/2010 7:52,1/1/1990 0:00
93.231,Epidemiology Cooperative Agreements,Department of Health and Human Services / Indian Health Service,B - Cooperative Agreements,7/8/2010 7:52,1/1/1996 0:00
93.232,Loan Repayment Program for General Research,Department of Health and Human Services / National Institutes of Health,B - PROJECT GRANTS,7/9/2010 11:29,1/1/1996 0:00
93.233,National Center on Sleep Disorders Research,Department of Health and Human Services / National Institutes of Health,B - PROJECT GRANTS,7/9/2010 8:15,1/1/1997 0:00
93.234,Traumatic Brain Injury State Demonstration Grant Program,Department of Health and Human Services / Health Resources and Services Administration,B - PROJECT GRANTS,7/9/2010 8:17,1/1/1997 0:00
93.235,Abstinence Education Program,Department of Health and Human Services / Administration for Children and Families,A - FORMULA GRANTS,7/29/2010 7:43,1/1/1997 0:00
93.239,Policy Research and Evaluation Grants,Department of Health and Human Services / Office of the Secretary,B - PROJECT GRANTS,9/12/2008 0:00,1/1/1998 0:00
93.240,State Capacity Building,Department of Health and Human Services / Agency for Toxic Substances and Disease Registry,B - PROJECT GRANTS,7/15/2010 7:42,1/1/1999 0:00
93.241,State Rural Hospital Flexibility Program,Department of Health and Human Services / Health Resources and Services Administration,B - PROJECT GRANTS,9/16/2010 11:11,1/1/1999 0:00
93.242,Mental Health Research Grants,Department of Health and Human Services / National Institutes of Health,"B - Cooperative Agreements, B - Project Grants",7/9/2010 11:38,1/1/1990 0:00
93.243,Substance Abuse and Mental Health Services_Projects of Regional and National Significance,Department of Health and Human Services / Substance Abuse and Mental Health Services Administration,B - PROJECT GRANTS,10/18/2010 11:28,1/1/2002 0:00
93.247,Advanced Nursing Education Grant Program,Department of Health and Human Services / Health Resources and Services Administration,B - PROJECT GRANTS,7/1/2010 15:15,1/1/2000 0:00
93.249,Public Health Training Centers Grant Program,Department of Health and Human Services / Health Resources and Services Administration,B - Cooperative Agreements,7/2/2010 10:18,1/1/2000 0:00
93.250,Geriatric Academic Career Awards,Department of Health and Human Services / Health Resources and Services Administration,B - Project Grants,7/2/2010 10:19,1/1/2000 0:00
93.251,Universal Newborn Hearing Screening,Department of Health and Human Services / Health Resources and Services Administration,B - PROJECT GRANTS,7/9/2010 8:19,1/1/2000 0:00
93.253,Poison Center Support and Enhancement Grant Program,Department of Health and Human Services / Health Resources and Services Administration,"B - Cooperative Agreements, B - Project Grants",9/16/2010 11:11,1/1/2000 0:00
93.254,Infant Adoption Awareness Training,Department of Health and Human Services / Administration for Children and Families,B - PROJECT GRANTS,7/2/2010 7:21,1/1/2001 0:00
93.255,Children's Hospitals Graduate Medical Education Payment,Department of Health and Human Services / Health Resources and Services Administration,C - DIRECT PAYMENTS FOR A SPECIFIED USE,7/2/2010 10:19,1/1/2001 0:00
93.256,State Health Access Program,Department of Health and Human Services / Health Resources and Services Administration,B - PROJECT GRANTS,7/1/2010 15:16,1/1/2001 0:00
93.257,"Grants for Education, Prevention, and Early Detection of Radiogenic Cancers and Diseases",Department of Health and Human Services / Health Resources and Services Administration,B - PROJECT GRANTS,7/1/2010 15:17,1/1/2002 0:00
93.259,Rural Access to Emergency Devices Grant,Department of Health and Human Services / Health Resources and Services Administration,B - PROJECT GRANTS,7/9/2010 8:24,1/1/2002 0:00
93.260,Family Planning_Personnel Training,Department of Health and Human Services / Office of Population Affairs,B - PROJECT GRANTS,10/1/2010 8:23,1/1/1990 0:00
93.262,Occupational Safety and Health Program,Department of Health and Human Services / Centers for Disease Control and Prevention,"B - Project Grants, M - Training",7/16/2010 8:09,1/1/1990 0:00
93.264,Nurse Faculty Loan Program (NFLP),Department of Health and Human Services / Health Resources and Services Administration,E - Direct Loans,7/1/2010 15:17,1/1/2003 0:00
93.265,Comprehensive Geriatric Education Program(CGEP),Department of Health and Human Services / Health Resources and Services Administration,B - PROJECT GRANTS,7/2/2010 10:19,1/1/2003 0:00
93.266,Rapid Expansion of Antiretroviral Therapy Programs for HIV-Infected Persons in Selected Countries in Africa and the Caribbean Under the President's Emergency Plan for AIDS Relief,Department of Health and Human Services / Health Resources and Services Administration,B - Cooperative Agreements,7/12/2010 8:34,1/1/2004 0:00
93.267,State Grants for Protection and Advocacy Services,Department of Health and Human Services / Health Resources and Services Administration,A - FORMULA GRANTS,7/9/2010 8:27,1/1/2004 0:00
93.268,Immunization Grants,Department of Health and Human Services / Centers for Disease Control and Prevention,B - PROJECT GRANTS,9/22/2010 7:29,1/1/1990 0:00
93.269,Complex Humanitarian Emergency and War-Related Injury Public Health Activities,Department of Health and Human Services / Centers for Disease Control and Prevention,B - PROJECT GRANTS,7/16/2010 8:10,1/1/2008 0:00
93.270,Adult Viral Hepatitis Prevention and Control,Department of Health and Human Services / Centers for Disease Control and Prevention,B - Cooperative Agreements,9/22/2010 7:29,1/1/2008 0:00
93.273,Alcohol Research Programs,Department of Health and Human Services / National Institutes of Health,B - PROJECT GRANTS,9/19/2010 20:28,1/1/1990 0:00
93.275,Substance Abuse and Mental Health Services-Access to Recovery,Department of Health and Human Services / Substance Abuse and Mental Health Services Administration,B - Project Grants (Discretionary),10/18/2010 11:29,1/1/2004 0:00
93.279,Drug Abuse and Addiction Research Programs,Department of Health and Human Services / National Institutes of Health,"B - PROJECT GRANTS, M - TRAINING",7/9/2010 11:29,1/1/1990 0:00
93.280,National Institutes of Health Loan Repayment Program for Clinical Researchers,Department of Health and Human Services / National Institutes of Health,C - Direct Payments for Specified Use,9/19/2010 20:36,1/1/2003 0:00
93.281,Mental Health Research Career/Scientist Development Awards,Department of Health and Human Services / National Institutes of Health,B - PROJECT GRANTS,7/9/2010 11:52,1/1/1990 0:00
93.282,Mental Health National Research Service Awards for Research Training,Department of Health and Human Services / National Institutes of Health,M - Training,7/9/2010 12:01,1/1/1990 0:00
93.283,Centers for Disease Control and Prevention_Investigations and Technical Assistance,Department of Health and Human Services / Centers for Disease Control and Prevention,B - Cooperative Agreements,9/22/2010 7:29,1/1/1990 0:00
93.284,Injury Prevention Program for American Indians and Alaskan Natives_Cooperative Agreements,Department of Health and Human Services / Indian Health Service,B - Cooperative Agreements,7/8/2010 8:17,1/1/2000 0:00
93.285,National Institutes of Health Pediatric Research Loan Repayment Program,Department of Health and Human Services / National Institutes of Health,C - DIRECT PAYMENTS FOR A SPECIFIED USE,9/27/2010 9:13,1/1/2004 0:00
93.286,Discovery and Applied Research for Technological Innovations to Improve Human Health,Department of Health and Human Services / National Institutes of Health,B - PROJECT GRANTS,7/15/2010 11:28,1/1/2002 0:00
93.288,National Health Service Corps Scholarship Program,Department of Health and Human Services / Health Resources and Services Administration,C - DIRECT PAYMENTS FOR A SPECIFIED USE,7/1/2010 15:18,1/1/1990 0:00
93.289,"President's Council on Fitness, Sports, and Nutrition",Department of Health and Human Services / President's Council on Physical Fitness and Sports,K - ADVISORY SERVICES AND COUNSELING,10/26/2010 10:16,1/1/1990 0:00
93.290,National Community Centers of Excellence in Women's Health,Department of Health and Human Services / Office of the Secretary,B - PROJECT GRANTS,10/1/2010 8:23,1/1/2000 0:00
93.291,Surplus Property Utilization,Department of Health and Human Services / Program Support Center,"H - SALE, EXCHANGE, OR DONATION OF PROPERTY OR GOODS",6/23/2010 7:46,1/1/1990 0:00
93.295,Intergenerational Approaches to HIV/AIDS Prevention Education with Women across The Lifespan Pilot Program,Department of Health and Human Services / Office of the Secretary,B - PROJECT GRANTS,10/1/2010 8:23,1/1/2006 0:00
93.296,State Partnership Grant Program to Improve Minority Health,Department of Health and Human Services / Office of the Secretary,B - PROJECT GRANTS,10/1/2010 12:30,1/1/2006 0:00
93.297,Teenage Pregnancy Prevention Program,Department of Health and Human Services / Office of the Secretary,B - Cooperative Agreements,4/1/2010 18:56,4/1/2010 18:56
93.300,National Center for Health Workforce Analysis,Department of Health and Human Services / Health Resources and Services Administration,B - Cooperative Agreements,7/13/2010 13:53,1/1/2002 0:00
93.301,Small Rural Hospital Improvement Grant Program,Department of Health and Human Services / Health Resources and Services Administration,B - PROJECT GRANTS,7/9/2010 11:29,1/1/2002 0:00
93.307,Minority Health and Health Disparities Research,Department of Health and Human Services / National Institutes of Health,B - PROJECT GRANTS,9/19/2010 20:36,11/23/2009 13:12
93.310,Trans-NIH Research Support,Department of Health and Human Services / National Institutes of Health,"B - PROJECT GRANTS, M - TRAINING",7/15/2010 11:29,1/1/2006 0:00
93.338,Foreign Public Health Construction,Department of Health and Human Services / Centers for Disease Control and Prevention,B - Project Grants,8/4/2010 8:04,8/4/2010 8:04
93.342,"Health Professions Student Loans, Including Primary Care Loans/Loans for Disadvantaged Students",Department of Health and Human Services / Health Resources and Services Administration,E - DIRECT LOANS,7/1/2010 15:18,1/1/1990 0:00
93.358,Advanced Nursing Education Traineeships,Department of Health and Human Services / Health Resources and Services Administration,A - Formula Grants,7/1/2010 15:19,1/1/1990 0:00
93.359,"Nurse Education, Practice and Retention Grants",Department of Health and Human Services / Health Resources and Services Administration,"B - Cooperative Agreements, B - Project Grants",7/1/2010 15:19,1/1/1990 0:00
93.361,Nursing Research,Department of Health and Human Services / National Institutes of Health,B - PROJECT GRANTS,9/19/2010 20:38,1/1/1990 0:00
93.364,Nursing Student Loans,Department of Health and Human Services / Health Resources and Services Administration,E - DIRECT LOANS,7/1/2010 15:20,1/1/1990 0:00
93.365,Sickle Cell Treatment Demonstration Program,Department of Health and Human Services / Health Resources and Services Administration,B - Cooperative Agreements,7/2/2010 10:20,1/1/2006 0:00
93.389,National Center for Research Resources,Department of Health and Human Services / National Institutes of Health,B - PROJECT GRANTS,7/9/2010 13:36,1/1/1990 0:00
93.393,Cancer Cause and Prevention Research,Department of Health and Human Services / National Institutes of Health,B - PROJECT GRANTS,7/9/2010 11:30,1/1/1990 0:00
93.394,Cancer Detection and Diagnosis Research,Department of Health and Human Services / National Institutes of Health,B - PROJECT GRANTS,7/9/2010 11:32,1/1/1990 0:00
93.395,Cancer Treatment Research,Department of Health and Human Services / National Institutes of Health,B - PROJECT GRANTS,7/9/2010 11:33,1/1/1990 0:00
93.396,Cancer Biology Research,Department of Health and Human Services / National Institutes of Health,B - PROJECT GRANTS,7/9/2010 11:36,1/1/1990 0:00
93.397,Cancer Centers Support Grants,Department of Health and Human Services / National Institutes of Health,B - PROJECT GRANTS,7/9/2010 11:41,1/1/1990 0:00
93.398,Cancer Research Manpower,Department of Health and Human Services / National Institutes of Health,B - PROJECT GRANTS,7/9/2010 11:43,1/1/1990 0:00
93.399,Cancer Control,Department of Health and Human Services / National Institutes of Health,B - PROJECT GRANTS,7/9/2010 11:48,1/1/1990 0:00
93.400,National Health Service Corps Scholarship Program,Department of Health and Human Services / Health Resources and Services Administration,C - Direct Payments for Specified Use,7/1/2010 15:21,5/22/2009 9:42
93.402,ARRA - State Loan Repayment Program,Department of Health and Human Services / Health Resources and Services Administration,"B - Project Grants, C - Direct Payments for Specified Use",9/16/2010 11:12,7/14/2009 10:41
93.403,ARRA Grants for Training in Primary Care Medicine and Dentistry Training and Enhancement,Department of Health and Human Services / Health Resources and Services Administration,B - Project Grants,7/16/2010 8:10,7/15/2009 10:24
93.404,ARRA – Dental Public Health Residency Training Grants,Department of Health and Human Services / Health Resources and Services Administration,B - Project Grants,7/16/2010 8:10,7/15/2009 11:17
93.405,ARRA - Public Health Traineeship Program,Department of Health and Human Services / Health Resources and Services Administration,A - Formula Grants,7/13/2010 13:54,7/16/2009 10:19
93.406,Nursing Education Loan Repayment Program (NELRP),Department of Health and Human Services / Health Resources and Services Administration,C - Direct Payments for Specified Use,7/2/2010 10:25,5/22/2009 9:42
93.407,ARRA - Scholarships for Disadvantaged Students,Department of Health and Human Services / Health Resources and Services Administration,B - Project Grants,7/13/2010 13:54,7/16/2009 10:21
93.408,ARRA - Nurse Faculty Loan Program,Department of Health and Human Services / Health Resources and Services Administration,B - Project Grants,7/13/2010 13:54,7/16/2009 10:22
93.409,Faculty Loan Repayment Programs,Department of Health and Human Services / Health Resources and Services Administration,C - Direct Payments for Specified Use,7/2/2010 10:27,5/22/2009 9:42
93.410,ARRA – Licensure Portability Grant Program,Department of Health and Human Services / Health Resources and Services Administration,B - Project Grants,7/13/2010 13:55,7/16/2009 10:31
93.411,ARRA – Equipment to Enhance Training for Health Professionals,Department of Health and Human Services / Health Resources and Services Administration,B - Project Grants,7/13/2010 13:55,7/21/2009 11:21
93.412,ARRA - Preventive Medicine Residency Program,Department of Health and Human Services / Health Resources and Services Administration,"B - Project Grants, M - Training",7/16/2010 8:11,7/16/2009 10:29
93.414,ARRA - State Primary Care Offices,Department of Health and Human Services / Health Resources and Services Administration,B - Cooperative Agreements,7/13/2010 13:55,7/16/2009 10:28
93.415,ARRA - Centers of Excellence,Department of Health and Human Services / Health Resources and Services Administration,B - Project Grants,7/13/2010 13:56,7/16/2009 10:30
93.416,ARRA - Health Careers Opportunity Program,Department of Health and Human Services / Health Resources and Services Administration,B - Project Grants,7/13/2010 13:56,7/17/2009 9:47
93.417,ARRA - Nursing Workforce Diversity,Department of Health and Human Services / Health Resources and Services Administration,B - Project Grants,7/13/2010 13:56,7/17/2009 9:48
93.419,ARRA - Maternal and Child Health (MCH) Pediatric Research Network Program,Department of Health and Human Services / Health Resources and Services Administration,B - Project Grants,7/13/2010 13:58,9/24/2009 11:03
93.420,ARRA - Community Health Applied Research Network,Department of Health and Human Services / Health Resources and Services Administration,"B - Cooperative Agreements (Discretionary Grants), C - Direct Payments for Specified Use",7/13/2010 13:59,12/30/2009 14:51
93.440,National Project Management of the Healthcare Communities Knowledge Gateway,Department of Health and Human Services / Health Resources and Services Administration,B - Cooperative Agreements (Discretionary Grants),7/14/2010 8:12,7/14/2010 8:12
93.441,Indian Self-Determination,Department of Health and Human Services / Indian Health Service,C - DIRECT PAYMENTS FOR A SPECIFIED USE,9/21/2010 14:08,1/1/2000 0:00
93.442,Special Diabetes Program for Indians (SDPI) Competitive Grant Program,Department of Health and Human Services / Indian Health Service,B - Cooperative Agreements,7/8/2010 8:22,1/1/2004 0:00
93.443,Health Promotion/Disease Prevention Program for American Indians and Alaska Natives,Department of Health and Human Services / Indian Health Service,B - PROJECT GRANTS,7/8/2010 8:47,1/1/2008 0:00
93.444,Tribal Self-Governance Program: Planning and Negotiation Cooperative Agreement,Department of Health and Human Services / Indian Health Service,B - Cooperative Agreements,7/8/2010 8:48,1/1/2008 0:00
93.445,Indian Health Service Sanitation Facilities Construction Program,Department of Health and Human Services / Indian Health Service,J - Provision of Specialized Services,7/8/2010 8:48,3/12/2010 12:24
