#,Program Title,Agency/Office,Types of Assistance,Date Modified,Date Published
93.448,Food Safety and Security Monitoring Project,Department of Health and Human Services / Food and Drug Administration,B - Cooperative Agreements,9/13/2010 12:02,1/1/2005 0:00
93.449,Ruminant Feed Ban Support Project,Department of Health and Human Services / Food and Drug Administration,B - Cooperative Agreements,7/13/2009 8:03,1/1/2005 0:00
93.451,The Linkage to Life Program: Rebuilding Broken Bridges for Minority Families Impacted by HIV/AIDS.,Department of Health and Human Services / Office of the Secretary,B - Cooperative Agreements,7/29/2010 9:19,7/29/2010 9:19
93.452,Health Improvement for Re-entering Ex-offenders Initiative (HIRE) HIV/AIDS,Department of Health and Human Services / Office of the Secretary,B - Cooperative Agreements,9/20/2010 10:22,9/20/2010 10:22
93.453,Coalition for a Healthier Community,Department of Health and Human Services / Office of the Secretary,B - Cooperative Agreements,9/20/2010 10:22,9/20/2010 10:22
93.500,Pregnancy Assistance Fund Program,Department of Health and Human Services / Office of the Secretary,B - Project Grants,5/10/2010 8:07,5/10/2010 8:07
93.501,Affordable Care Act (ACA) Grants for School-Based Health Center Capital Expenditures,Department of Health and Human Services / Health Resources and Services Administration,B - Project Grants,7/2/2010 11:06,6/2/2010 11:30
93.502,Affordable Care Act (ACA) Infrastructure to Expand Access to Care,Department of Health and Human Services / Health Resources and Services Administration,B - Project Grants,9/25/2010 9:09,6/2/2010 11:31
93.503,Affordable Care Act (ACA) Nursing and Home Health Aides Training Program,Department of Health and Human Services / Health Resources and Services Administration,B - Project Grants,10/1/2010 12:30,6/2/2010 11:32
93.504,Affordable Care Act (ACA) – Family to Family Health Information Centers,Department of Health and Human Services / Health Resources and Services Administration,B - Project Grants,7/1/2010 12:16,6/7/2010 8:13
93.505,"Affordable Care Act (ACA) Maternal, Infant, and Early Childhood Home Visiting Program",Department of Health and Human Services / Health Resources and Services Administration,"A - Formula Grants, B - Project Grants",7/12/2010 8:35,5/28/2010 17:26
93.506,ACA Nationwide Program for National and State Background Checks for Direct Patient Access Employees of Long Term Care Facilities and Providers,Department of Health and Human Services / Centers for Medicare and Medicaid Services,B - Project Grants,6/3/2010 14:18,6/3/2010 14:18
93.507,Strengthening Public Health Infrastructure for Improved Health Outcomes,Department of Health and Human Services / Centers for Disease Control and Prevention,B - Cooperative Agreements,9/22/2010 7:29,7/8/2010 8:49
93.508,"Affordable Care Act (ACA) Tribal Maternal, Infant, and Early Childhood Home Visiting Program",Department of Health and Human Services / Administration for Children and Families,B - Project Grants,6/24/2010 16:20,6/24/2010 16:20
93.510,Affordable Care Act (ACA) Primary Care Residency Expansion Program,Department of Health and Human Services / Health Resources and Services Administration,B - Project Grants,9/16/2010 11:14,6/16/2010 13:36
93.512,Affordable Care Act (ACA) Personal and Home Care Aide State Training Program (PHCAST),Department of Health and Human Services / Health Resources and Services Administration,B - Project Grants,9/16/2010 11:14,6/16/2010 13:39
93.513,Affordable Care Act (ACA) Advanced Nursing Education Expansion Initiative,Department of Health and Human Services / Health Resources and Services Administration,B - Project Grants,7/7/2010 7:38,6/16/2010 13:38
93.514,Affordable Care Act (ACA) Expansion of Physician Assistant Training Program,Department of Health and Human Services / Health Resources and Services Administration,B - Project Grants,9/16/2010 11:14,6/16/2010 13:38
93.515,Affordable Care Act (ACA) Nurse-Managed Health Clinics,Department of Health and Human Services / Health Resources and Services Administration,B - Project Grants,7/7/2010 7:39,6/16/2010 13:38
93.516,Affordable Care Act (ACA) Public Health Training Centers Program,Department of Health and Human Services / Health Resources and Services Administration,B - Cooperative Agreements,7/8/2010 10:13,7/8/2010 10:13
93.519,Affordable Care Act (ACA) – Consumer Assistance Program Grants,Department of Health and Human Services / Office of the Secretary,B - Project Grants,7/18/2010 22:58,7/13/2010 8:25
93.520,Centers for Disease Control and Prevention –Affordable Care Act (ACA) – Communities Putting Prevention to Work,Department of Health and Human Services / Centers for Disease Control and Prevention,B - Cooperative Agreements,9/22/2010 7:29,7/21/2010 12:39
93.521,"The Affordable Care Act:  Building Epidemiology, Laboratory, and Health Information Systems Capacity in the Epidemiology and Laboratory Capacity for Infectious Disease (ELC) and Emerging Infections Program (EIP) Cooperative Agreements",Department of Health and Human Services / Centers for Disease Control and Prevention,B - Cooperative Agreements,7/30/2010 15:42,7/30/2010 15:42
93.522,Affordable Care Act (ACA) Prevention Center for Healthy Weight,Department of Health and Human Services / Health Resources and Services Administration,B - Cooperative Agreements,7/12/2010 8:35,7/12/2010 8:35
93.523,The Affordable Care Act: Human Immunodeficiency Virus (HIV) Prevention and Public Health Fund Activities,Department of Health and Human Services / Centers for Disease Control and Prevention,B - Cooperative Agreements,9/25/2010 9:10,7/21/2010 12:42
93.524,The Affordable Care Act (ACA): Capacity Building Assistance to Strengthen Public Health Infrastructure and Performance,Department of Health and Human Services / Centers for Disease Control and Prevention,B - Cooperative Agreements,7/21/2010 12:42,7/21/2010 12:42
93.525,State Planning and Establishment Grants for the Affordable Care Act (ACA)’s Exchanges,Department of Health and Human Services / Office of the Secretary,B - Cooperative Agreements,1/25/2011 7:34,7/28/2010 19:51
93.526,Affordable Care Act (ACA) Grants for Capital Development in Health Centers,Department of Health and Human Services / Health Resources and Services Administration,B - Project Grants,8/31/2010 8:12,8/31/2010 8:12
93.527,Affordable Care Act (ACA) Grants for New and Expanded Services under the Health Center Program,Department of Health and Human Services / Health Resources and Services Administration,B - Project Grants,8/6/2010 12:22,8/6/2010 12:22
93.528,National Forum for State and Territorial Chief Executives,Department of Health and Human Services / Health Resources and Services Administration,B - Cooperative Agreements,1/19/2011 11:15,1/19/2011 11:15
93.530,Affordable Care Act - Teaching Health Center Graduate Medical Education Payments Program,Department of Health and Human Services / Health Resources and Services Administration,"A - Formula Grants, C - Direct Payments for Specified Use",11/2/2010 10:48,11/2/2010 10:48
93.534,Affordable Care Act Program for Early Detection of Certain Medical Conditions Related to Environmental Health Hazards,Department of Health and Human Services / Agency for Toxic Substances and Disease Registry,B - Project Grants (Discretionary),12/18/2010 9:44,12/18/2010 9:44
93.535,Affordable Care Act (ACA) Childhood Obesity Research Demonstration,Department of Health and Human Services / Centers for Disease Control and Prevention,B - Cooperative Agreements,1/3/2011 7:35,1/3/2011 7:35
93.537,Affordable Care Act Medicaid Emergency Psychiatric Demonstration,Department of Health and Human Services / Centers for Medicare and Medicaid Services,C - Direct Payments for Specified Use,1/3/2011 7:37,1/3/2011 7:37
93.551,Abandoned Infants,Department of Health and Human Services / Administration for Children and Families,B - PROJECT GRANTS,7/6/2010 14:37,1/1/1990 0:00
93.557,"Education and Prevention Grants to Reduce Sexual Abuse of Runaway, Homeless and Street Youth",Department of Health and Human Services / Administration for Children and Families,B - PROJECT GRANTS,7/6/2010 14:33,1/1/1999 0:00
93.566,Refugee and Entrant Assistance_State Administered Programs,Department of Health and Human Services / Administration for Children and Families,A - FORMULA GRANTS,7/6/2010 15:32,1/1/1992 0:00
93.569,Community Services Block Grant,Department of Health and Human Services / Administration for Children and Families,A - FORMULA GRANTS,7/18/2010 23:01,1/1/1992 0:00
93.598,Services to Victims of a Severe Form of Trafficking,Department of Health and Human Services / Administration for Children and Families,B - PROJECT GRANTS,7/16/2010 8:12,1/1/2001 0:00
93.599,Chafee Education and Training Vouchers Program (ETV),Department of Health and Human Services / Administration for Children and Families,A - FORMULA GRANTS,7/7/2010 7:42,1/1/2003 0:00
93.600,Head Start,Department of Health and Human Services / Administration for Children and Families,B - PROJECT GRANTS,7/12/2010 8:36,1/1/1990 0:00
93.601,Child Support Enforcement Demonstrations and Special Projects,Department of Health and Human Services / Administration for Children and Families,B - PROJECT GRANTS,7/16/2010 8:12,1/1/1999 0:00
93.603,Adoption Incentive Payments,Department of Health and Human Services / Administration for Children and Families,A - FORMULA GRANTS,7/7/2010 7:44,1/1/1999 0:00
93.604,Assistance for Torture Victims,Department of Health and Human Services / Administration for Children and Families,B - PROJECT GRANTS,7/2/2010 7:19,1/1/2000 0:00
93.612,Native American Programs,Department of Health and Human Services / Administration for Children and Families,B - PROJECT GRANTS,7/18/2010 23:04,1/1/1990 0:00
93.613,President's Committee for People with Intellectual Disabilities (PCPID),Department of Health and Human Services / Administration for Children and Families,L - Information,7/7/2010 7:51,1/1/1990 0:00
93.616,Mentoring Children of Prisoners,Department of Health and Human Services / Administration for Children and Families,B - PROJECT GRANTS,7/18/2010 23:05,1/1/2003 0:00
93.617,Voting Access for Individuals with Disabilities_Grants to States,Department of Health and Human Services / Administration for Children and Families,A - FORMULA GRANTS,6/23/2010 7:47,1/1/2003 0:00
93.630,Developmental Disabilities Basic Support and Advocacy Grants,Department of Health and Human Services / Administration for Children and Families,A - FORMULA GRANTS,7/1/2010 12:15,1/1/1990 0:00
93.631,Developmental Disabilities Projects of National Significance,Department of Health and Human Services / Administration for Children and Families,B - PROJECT GRANTS,7/1/2010 12:17,1/1/1990 0:00
93.632,"University Centers for Excellence in Developmental Disabilities Education, Research, and Service",Department of Health and Human Services / Administration for Children and Families,B - PROJECT GRANTS,7/1/2010 15:35,1/1/1990 0:00
93.643,Children's Justice Grants to States,Department of Health and Human Services / Administration for Children and Families,A - FORMULA GRANTS,7/18/2010 23:05,1/1/1990 0:00
93.701,Trans-NIH Recovery Act Research Support,Department of Health and Human Services / National Institutes of Health,"B - Project Grants (Capacity Building and Complaint Processing, Training)",9/19/2010 20:39,5/15/2009 17:33
93.702,"National Center for Research Resources, Recovery Act Construction Support",Department of Health and Human Services / National Institutes of Health,B - Project Grants,6/29/2010 7:58,5/15/2009 17:33
93.703,ARRA – Grants to Health Center Programs,Department of Health and Human Services / Health Resources and Services Administration,B - Project Grants,7/16/2010 8:12,5/22/2009 9:42
93.704,Trans-NIH Recovery Act Loan Repayment Support,Department of Health and Human Services / National Institutes of Health,C - Direct Payments for Specified Use,7/28/2010 7:51,5/15/2009 17:33
93.712,ARRA - Immunization,Department of Health and Human Services / Centers for Disease Control and Prevention,B - Cooperative Agreements,9/22/2010 7:30,6/11/2009 14:03
93.715,Recovery Act – Comparative Effectiveness Research - AHRQ,Department of Health and Human Services / Agency for Healthcare Research and Quality,B - Project Grants,8/23/2010 10:31,8/19/2009 10:40
93.717,ARRA - Preventing Healthcare-Associated Infections,Department of Health and Human Services / Centers for Disease Control and Prevention,B - Cooperative Agreements,9/22/2010 7:30,6/10/2009 11:41
93.718,Health Information Technology Regional Extension Centers Program,Department of Health and Human Services / Office of the Secretary,B - Cooperative Agreements (Discretionary Grants),7/21/2010 12:34,7/29/2009 17:04
93.719,ARRA - State Grants to Promote Health Information Technology,Department of Health and Human Services / Office of the Secretary,B - Cooperative Agreements (Discretionary Grants),7/8/2010 8:50,7/29/2009 17:04
93.720,ARRA - Survey and Certification Ambulatory Surgical Center Healthcare-Associated Infection (ASC-HAI) Prevention Initiative,Department of Health and Human Services / Centers for Medicare and Medicaid Services,B - Project Grants,7/22/2010 11:14,8/13/2009 10:59
93.721,ARRA - Health Information Technology Professionals in Health Care,Department of Health and Human Services / Office of the Secretary,"B - Cooperative Agreements (Discretionary Grants), B - Project Grants (Discretionary)",7/8/2010 8:50,10/13/2009 9:52
93.722,ARRA - IHS Tribal Agreements,Department of Health and Human Services / Indian Health Service,B - Project Grants (Contracts),7/8/2010 9:13,8/19/2009 10:38
93.723,"ARRA - Prevention and Wellness-State, Territories and Pacific Islands",Department of Health and Human Services / Centers for Disease Control and Prevention,B - Cooperative Agreements,9/25/2010 9:10,9/11/2009 8:43
93.724,ARRA - Prevention and Wellness – Communities Putting Prevention to Work Funding Opportunities Announcement (FOA),Department of Health and Human Services / Centers for Disease Control and Prevention,B - Cooperative Agreements (Discretionary Grants),9/25/2010 9:11,9/11/2009 8:43
93.725,ARRA - Communities Putting Prevention to Work: Chronic Disease Self-Management Program,Department of Health and Human Services / Administration on Aging,B - Cooperative Agreements (Discretionary Grants),9/23/2010 9:14,11/25/2009 11:34
93.726,ARRA Accelerating Adoption of Comparative Effectiveness Research (CER),Department of Health and Human Services / Office of the Secretary,B - Project Grants,1/1/2010 12:05,1/1/2010 12:05
93.727,ARRA - Health Information Technology - Beacon Communities,Department of Health and Human Services / Office of the Secretary,B - Cooperative Agreements,7/8/2010 9:13,12/1/2009 14:49
93.728,ARRA - Strategic Health IT Advanced Research Projects (SHARP),Department of Health and Human Services / Office of the Secretary,B - Cooperative Agreements,7/8/2010 9:14,12/16/2009 7:32
93.729,ARRA –Health Information Technology and Public Health,Department of Health and Human Services / Centers for Disease Control and Prevention,B - Cooperative Agreements,3/4/2010 14:56,2/3/2010 9:37
93.730,ARRA Prevention Research Centers Comparative Effectiveness Research Program,Department of Health and Human Services / Centers for Disease Control and Prevention,B - Cooperative Agreements,1/28/2010 10:56,1/28/2010 10:56
93.731,ARRA - Prevention and Wellness - Leveraging National Organizations,Department of Health and Human Services / Office of the Secretary,B - Cooperative Agreements,2/12/2010 11:11,2/12/2010 11:11
93.760,Rural PACE (Program of All-Inclusive Care for the Elderly) Provider Grant Program,Department of Health and Human Services / Centers for Medicare and Medicaid Services,B - PROJECT GRANTS,7/9/2010 12:19,1/1/2006 0:00
93.767,Children's Health Insurance Program,Department of Health and Human Services / Centers for Medicare and Medicaid Services,A - FORMULA GRANTS,10/21/2010 13:13,1/1/1998 0:00
93.768,Medicaid Infrastructure Grants To Support the Competitive Employment of People with Disabilities,Department of Health and Human Services / Centers for Medicare and Medicaid Services,B - PROJECT GRANTS,6/9/2010 13:24,1/1/2000 0:00
93.769,Demonstration to Maintain Independence and Employment,Department of Health and Human Services / Centers for Medicare and Medicaid Services,B - PROJECT GRANTS,6/17/2010 13:27,1/1/2000 0:00
93.770,Medicare_Prescription Drug Coverage,Department of Health and Human Services / Centers for Medicare and Medicaid Services,C - DIRECT PAYMENTS FOR A SPECIFIED USE,7/27/2010 9:53,1/1/2005 0:00
93.773,Medicare_Hospital Insurance,Department of Health and Human Services / Centers for Medicare and Medicaid Services,C - DIRECT PAYMENTS FOR A SPECIFIED USE,12/27/2010 12:47,1/1/1990 0:00
93.774,Medicare_Supplementary Medical Insurance,Department of Health and Human Services / Centers for Medicare and Medicaid Services,C - DIRECT PAYMENTS FOR A SPECIFIED USE,7/22/2010 7:45,1/1/1990 0:00
93.777,State Survey and Certification of Health Care Providers and Suppliers (Title XVIII) Medicare,Department of Health and Human Services / Centers for Medicare and Medicaid Services,A - FORMULA GRANTS,9/20/2010 15:58,1/1/1990 0:00
93.778,Medical Assistance Program,Department of Health and Human Services / Centers for Medicare and Medicaid Services,A - FORMULA GRANTS,6/24/2010 15:52,1/1/1990 0:00
93.779,"Centers for Medicare and Medicaid Services (CMS) Research, Demonstrations and Evaluations",Department of Health and Human Services / Centers for Medicare and Medicaid Services,B - PROJECT GRANTS,9/21/2010 11:27,1/1/1990 0:00
93.780,Grants to States for Operation of Qualified High-Risk Pools,Department of Health and Human Services / Centers for Medicare and Medicaid Services,A - FORMULA GRANTS,6/11/2010 11:32,1/1/2003 0:00
93.784,Federal Reimbursement of Emergency Health Services Furnished to Undocumented Aliens,Department of Health and Human Services / Centers for Medicare and Medicaid Services,C - DIRECT PAYMENTS FOR A SPECIFIED USE,7/12/2010 14:03,1/1/2004 0:00
93.789,Alternatives to Psychiatric Residential Treatment Facilities for Children,Department of Health and Human Services / Centers for Medicare and Medicaid Services,B - PROJECT GRANTS,6/23/2010 7:50,1/1/2006 0:00
93.790,Alternate Non-Emergency Service Providers or Networks,Department of Health and Human Services / Centers for Medicare and Medicaid Services,B - PROJECT GRANTS,7/6/2010 11:27,1/1/2006 0:00
93.791,Money Follows the Person Rebalancing Demonstration,Department of Health and Human Services / Centers for Medicare and Medicaid Services,B - PROJECT GRANTS,6/21/2010 23:02,1/1/2006 0:00
93.793,Medicaid Transformation Grants,Department of Health and Human Services / Centers for Medicare and Medicaid Services,B - PROJECT GRANTS,6/24/2010 15:52,1/1/2006 0:00
93.796,State Survey Certification of Health Care Providers and Suppliers (Title XIX) Medicaid,Department of Health and Human Services / Centers for Medicare and Medicaid Services,A - Formula Grants,10/15/2010 7:32,10/15/2010 7:32
93.824,Area Health Education Centers Infrastructure Development Awards,Department of Health and Human Services / Health Resources and Services Administration,B - Cooperative Agreements,9/16/2010 11:15,1/1/1990 0:00
93.837,Cardiovascular Diseases Research,Department of Health and Human Services / National Institutes of Health,B - PROJECT GRANTS,7/9/2010 12:16,1/1/1990 0:00
93.838,Lung Diseases Research,Department of Health and Human Services / National Institutes of Health,B - PROJECT GRANTS,7/9/2010 12:16,1/1/1990 0:00
93.839,Blood Diseases and Resources Research,Department of Health and Human Services / National Institutes of Health,B - PROJECT GRANTS,7/9/2010 12:16,1/1/1990 0:00
93.846,"Arthritis, Musculoskeletal and Skin Diseases Research",Department of Health and Human Services / National Institutes of Health,B - PROJECT GRANTS,7/8/2010 9:14,1/1/1990 0:00
93.847,"Diabetes, Digestive, and Kidney Diseases Extramural Research",Department of Health and Human Services / National Institutes of Health,B - PROJECT GRANTS,7/9/2010 12:17,1/1/1990 0:00
93.853,Extramural Research Programs in the Neurosciences and Neurological Disorders,Department of Health and Human Services / National Institutes of Health,B - PROJECT GRANTS,7/8/2010 9:15,1/1/1990 0:00
93.855,"Allergy, Immunology and Transplantation Research",Department of Health and Human Services / National Institutes of Health,B - PROJECT GRANTS,7/9/2010 12:18,1/1/1990 0:00
93.856,Microbiology and Infectious Diseases Research,Department of Health and Human Services / National Institutes of Health,B - PROJECT GRANTS,7/9/2010 12:20,1/1/1990 0:00
93.859,Biomedical Research and Research Training,Department of Health and Human Services / National Institutes of Health,B - PROJECT GRANTS,7/9/2010 12:21,1/1/1990 0:00
93.865,Child Health and Human Development Extramural Research,Department of Health and Human Services / National Institutes of Health,B - PROJECT GRANTS,7/15/2010 11:45,1/1/1990 0:00
93.866,Aging Research,Department of Health and Human Services / National Institutes of Health,B - PROJECT GRANTS,7/9/2010 12:22,1/1/1990 0:00
93.867,Vision Research,Department of Health and Human Services / National Institutes of Health,B - PROJECT GRANTS,7/9/2010 12:30,1/1/1990 0:00
93.879,Medical Library Assistance,Department of Health and Human Services / National Institutes of Health,B - PROJECT GRANTS,6/29/2010 7:59,1/1/1990 0:00
93.884,Grants for Training in Primary Care Medicine and Dentistry,Department of Health and Human Services / Health Resources and Services Administration,B - PROJECT GRANTS,7/1/2010 16:10,1/1/1990 0:00
93.887,Health Care and Other Facilities,Department of Health and Human Services / Health Resources and Services Administration,B - Project Grants (for specified projects),7/2/2010 10:29,1/1/1990 0:00
93.888,Specially Selected Health Projects,Department of Health and Human Services / Health Resources and Services Administration,B - Project Grants (for specified projects),7/9/2010 12:33,1/1/2004 0:00
93.889,National Bioterrorism Hospital Preparedness Program,Department of Health and Human Services / Office of the Secretary,A - Formula Grants,7/8/2010 10:13,1/1/2004 0:00
93.910,Family and Community Violence Prevention Program,Department of Health and Human Services / Office of Minority Health,B - PROJECT GRANTS,10/1/2010 8:23,1/1/1990 0:00
93.912,"Rural Health Care Services Outreach, Rural Health Network Development and Small Health Care Provider  Quality Improvement Program",Department of Health and Human Services / Health Resources and Services Administration,B - PROJECT GRANTS,7/9/2010 12:34,1/1/1991 0:00
93.913,Grants to States for Operation of Offices of Rural Health,Department of Health and Human Services / Health Resources and Services Administration,"B - Cooperative Agreements, B - Project Grants",7/9/2010 12:34,1/1/1991 0:00
93.914,HIV Emergency Relief Project Grants,Department of Health and Human Services / Health Resources and Services Administration,B - PROJECT GRANTS,9/16/2010 11:15,1/1/1991 0:00
93.917,HIV Care Formula Grants,Department of Health and Human Services / Health Resources and Services Administration,A - FORMULA GRANTS,9/16/2010 11:16,1/1/1991 0:00
93.918,Grants to Provide Outpatient Early Intervention Services with Respect to HIV Disease,Department of Health and Human Services / Health Resources and Services Administration,B - PROJECT GRANTS,7/12/2010 10:10,1/1/1991 0:00
93.919,Cooperative Agreements for State-Based Comprehensive Breast and Cervical Cancer Early Detection Programs,Department of Health and Human Services / Centers for Disease Control and Prevention,B - Cooperative Agreements,7/23/2010 8:04,1/1/1991 0:00
93.923,Disadvantaged Health Professions Faculty Loan Repayment (FLRP) and Minority Faculty Fellowship Program (MFFP),Department of Health and Human Services / Health Resources and Services Administration,"B - PROJECT GRANTS, C - DIRECT PAYMENTS FOR A SPECIFIED USE",9/16/2010 11:16,1/1/1991 0:00
93.924,Ryan White HIV/AIDS Dental Reimbursements Community Based Dental Partnership,Department of Health and Human Services / Health Resources and Services Administration,"B - PROJECT GRANTS, C - Direct Payments for Specified Use",7/12/2010 10:08,1/1/1991 0:00
93.925,Scholarships for Health Professions Students from Disadvantaged Backgrounds,Department of Health and Human Services / Health Resources and Services Administration,B - PROJECT GRANTS,7/1/2010 14:49,1/1/1991 0:00
93.926,Healthy Start Initiative,Department of Health and Human Services / Health Resources and Services Administration,B - PROJECT GRANTS,7/12/2010 10:09,1/1/1991 0:00
93.928,Special Projects of National Significance,Department of Health and Human Services / Health Resources and Services Administration,B - PROJECT GRANTS,7/9/2010 12:34,1/1/1991 0:00
93.932,Native Hawaiian Health Systems,Department of Health and Human Services / Health Resources and Services Administration,B - PROJECT GRANTS,7/1/2010 14:47,1/1/1991 0:00
93.933,Demonstration Projects for Indian Health,Department of Health and Human Services / Indian Health Service,"B - Cooperative Agreements, B - Project Grants",7/8/2010 9:15,1/1/1991 0:00
93.936,National Institutes of Health Acquired Immunodeficiency Syndrome Research Loan Repayment Program,Department of Health and Human Services / National Institutes of Health,B - PROJECT GRANTS,7/9/2010 12:35,1/1/1992 0:00
93.938,Cooperative Agreements to Support Comprehensive School Health Programs to Prevent the Spread of HIV and Other Important Health Problems,Department of Health and Human Services / Centers for Disease Control and Prevention,B - PROJECT GRANTS,7/16/2010 8:14,1/1/1992 0:00
