#,Program Title,Agency/Office,Types of Assistance,Date Modified,Date Published
93.939,HIV Prevention Activities_Non-Governmental Organization Based,Department of Health and Human Services / Centers for Disease Control and Prevention,B - PROJECT GRANTS,9/25/2010 9:11,1/1/1992 0:00
93.940,HIV Prevention Activities_Health Department Based,Department of Health and Human Services / Centers for Disease Control and Prevention,B - PROJECT GRANTS,9/25/2010 9:11,1/1/1992 0:00
93.941,"HIV Demonstration, Research, Public and Professional Education Projects",Department of Health and Human Services / Centers for Disease Control and Prevention,B - PROJECT GRANTS,9/25/2010 9:11,1/1/1922 0:00
93.942,"Research, Treatment and Education Programs on Lyme Disease in the United States",Department of Health and Human Services / Centers for Disease Control and Prevention,"B - Cooperative Agreements, B - Project Grants (Cooperative Agreements or Contracts)",7/16/2010 8:14,1/1/1992 0:00
93.943,Epidemiologic Research Studies of Acquired Immunodeficiency Syndrome (AIDS) and Human Immunodeficiency Virus (HIV) Infection in Selected Population Groups,Department of Health and Human Services / Centers for Disease Control and Prevention,B - PROJECT GRANTS,9/25/2010 9:12,1/1/1992 0:00
93.944,Human Immunodeficiency Virus (HIV)/Acquired Immunodeficiency Virus Syndrome (AIDS) Surveillance,Department of Health and Human Services / Centers for Disease Control and Prevention,B - PROJECT GRANTS,7/23/2010 8:23,1/1/1992 0:00
93.945,Assistance Programs for Chronic Disease Prevention and Control,Department of Health and Human Services / Centers for Disease Control and Prevention,B - Cooperative Agreements,7/16/2010 8:14,1/1/1992 0:00
93.946,Cooperative Agreements to Support State-Based Safe Motherhood and Infant Health Initiative Programs,Department of Health and Human Services / Centers for Disease Control and Prevention,B - Cooperative Agreements,7/16/2010 8:14,1/1/1992 0:00
93.947,"Tuberculosis Demonstration, Research, Public and Professional Education",Department of Health and Human Services / Centers for Disease Control and Prevention,B - Cooperative Agreements,7/23/2010 8:24,1/1/1992 0:00
93.954,Tribal Recruitment and Retention of Health Professionals into Indian Health Programs,Department of Health and Human Services / Indian Health Service,M - Training,7/8/2010 9:16,1/1/1992 0:00
93.958,Block Grants for Community Mental Health Services,Department of Health and Human Services / Substance Abuse and Mental Health Services Administration,A - FORMULA GRANTS,8/9/2010 8:20,1/1/1993 0:00
93.959,Block Grants for Prevention and Treatment of Substance Abuse,Department of Health and Human Services / Substance Abuse and Mental Health Services Administration,A - Formula Grants,8/10/2010 7:48,1/1/1993 0:00
93.965,Coal Miners Respiratory Impairment Treatment Clinics and Services,Department of Health and Human Services / Health Resources and Services Administration,B - PROJECT GRANTS,7/2/2010 11:02,1/1/1990 0:00
93.970,Health Professions Recruitment Program for Indians,Department of Health and Human Services / Indian Health Service,M - Training,7/8/2010 9:16,1/1/1990 0:00
93.971,Health Professions Preparatory Scholarship Program for Indians,Department of Health and Human Services / Indian Health Service,M - Training,9/21/2010 14:08,1/1/1990 0:00
93.972,Health Professions Scholarship Program,Department of Health and Human Services / Indian Health Service,M - Training,9/21/2010 14:07,1/1/1990 0:00
93.974,Family Planning_Service Delivery Improvement Research Grants,Department of Health and Human Services / Office of Population Affairs,B - PROJECT GRANTS,10/1/2010 8:24,1/1/1990 0:00
93.975,National All Schedules Prescription Electronic Reporting Grant,Department of Health and Human Services / Substance Abuse and Mental Health Services Administration,A - Formula Grants,8/9/2010 8:24,6/12/2009 10:12
93.977,Preventive Health Services_Sexually Transmitted Diseases Control Grants,Department of Health and Human Services / Centers for Disease Control and Prevention,B - PROJECT GRANTS,9/22/2010 7:31,1/1/1990 0:00
93.978,"Preventive Health Services_Sexually Transmitted Diseases Research, Demonstrations, and Public Information and Education Grants",Department of Health and Human Services / Centers for Disease Control and Prevention,B - PROJECT GRANTS,9/22/2010 7:31,1/1/1990 0:00
93.982,Mental Health Disaster Assistance and Emergency Mental Health,Department of Health and Human Services / Substance Abuse and Mental Health Services Administration,B - PROJECT GRANTS,9/19/2010 20:45,1/1/1990 0:00
93.988,Cooperative Agreements for State-Based Diabetes Control Programs and Evaluation of Surveillance Systems,Department of Health and Human Services / Centers for Disease Control and Prevention,B - Cooperative Agreements,7/16/2010 8:15,1/1/1990 0:00
93.989,International Research and Research Training,Department of Health and Human Services / National Institutes of Health,"B - PROJECT GRANTS, M - TRAINING",7/9/2010 12:37,1/1/1990 0:00
93.990,National Health Promotion,Department of Health and Human Services / Office of Disease Prevention and Health Promotion,B - PROJECT GRANTS,10/1/2010 8:24,1/1/1990 0:00
93.991,Preventive Health and Health Services Block Grant,Department of Health and Human Services / Centers for Disease Control and Prevention,A - Formula Grants,9/22/2010 7:31,1/1/1990 0:00
93.993,Public Health Research Accreditation Project,Department of Health and Human Services / Centers for Disease Control and Prevention,B - PROJECT GRANTS,7/25/2010 18:05,1/1/2004 0:00
93.994,Maternal and Child Health Services Block Grant to the States,Department of Health and Human Services / Health Resources and Services Administration,A - FORMULA GRANTS,7/9/2010 12:39,1/1/1990 0:00
93.995,Adolescent Family Life_Demonstration Projects,Department of Health and Human Services / Office of Population Affairs,B - PROJECT GRANTS,9/29/2010 7:57,1/1/1990 0:00
94.019,Social Innovation Fund,Corporation for National and Community Service,B - Cooperative Agreements,8/23/2010 10:32,1/28/2010 7:44
96.001,Social Security_Disability Insurance,Social Security Administration,"C - DIRECT PAYMENTS FOR A SPECIFIED USE, D - DIRECT PAYMENTS WITH UNRESTRICTED USE",10/15/2008 0:00,1/1/1995 0:00
96.007,Social Security_Research and Demonstration,Social Security Administration,B - PROJECT GRANTS,10/23/2008 0:00,1/1/1995 0:00
96.008,Social Security - Work Incentives Planning and Assistance Program,Social Security Administration,B - PROJECT GRANTS,9/17/2008 0:00,1/1/2000 0:00
96.009,Social Security State Grants for Work Incentives Assistance to Disabled Beneficiaries,Social Security Administration,B - PROJECT GRANTS,9/17/2008 0:00,1/1/2002 0:00
97.122,Bio-Preparedness Collaboratory,Department of Homeland Security,B - Cooperative Agreements,9/23/2010 7:57,5/6/2010 15:54
