#,Program Title,Agency/Office,Types of Assistance,Date Modified,Date Published
10.207,Animal Health and Disease Research,Department of Agriculture / National Institute of Food and Agriculture,A - FORMULA GRANTS,8/17/2010 12:37,1/1/1981 0:00
10.405,Farm Labor Housing Loans and Grants,Department of Agriculture / Rural Development,"B - PROJECT GRANTS, F - GUARANTEED/INSURED LOANS",7/6/2010 6:25,1/1/1965 0:00
10.500,Cooperative Extension Service,Department of Agriculture / National Institute of Food and Agriculture,"A - FORMULA GRANTS, B - PROJECT GRANTS",9/14/2010 14:40,1/1/1970 0:00
10.567,Food Distribution Program on Indian Reservations,Department of Agriculture / Food and Nutrition Service,"B - PROJECT GRANTS, H - SALE, EXCHANGE, OR DONATION OF PROPERTY OR GOODS",8/9/2010 8:12,1/1/1983 0:00
10.700,National Agricultural Library,Department of Agriculture / Agricultural Research Service,L - DISSEMINATION OF TECHNICAL INFORMATION,7/28/2010 7:41,1/1/1969 0:00
10.855,Distance Learning and Telemedicine Loans and Grants,Department of Agriculture / Rural Development,"B - PROJECT GRANTS, E - DIRECT LOANS",11/28/2010 12:56,1/1/1992 0:00
11.001,Census Bureau Data Products,Department of Commerce / U.S. Census Bureau,L - DISSEMINATION OF TECHNICAL INFORMATION,9/17/2008 0:00,1/1/1965 0:00
11.002,Census Customer Services,Department of Commerce / U.S. Census Bureau,"K - ADVISORY SERVICES AND COUNSELING, L - DISSEMINATION OF TECHNICAL INFORMATION, M - TRAINING",9/17/2008 0:00,1/1/1970 0:00
11.300,Investments for Public Works and Economic Development Facilities,Department of Commerce / Economic Development Administration,B - Project Grants,10/22/2009 12:01,1/1/1965 0:00
11.413,Fishery Products Inspection and Certification,Department of Commerce / National Oceanic and Atmospheric Administration (NOAA),J - PROVISION OF SPECIALIZED SERVICES,6/30/2009 9:28,1/1/1971 0:00
12.350,Department of Defense HIV/AIDS Prevention Program,"Department of Defense / Department of the Navy, Office of the Chief of Naval Research",B - PROJECT GRANTS,9/19/2008 0:00,1/1/2006 0:00
12.420,Military Medical Research and Development,Department of Defense / U.S. Army Medical Command,B - PROJECT GRANTS,9/19/2008 0:00,1/1/1991 0:00
14.128,Mortgage Insurance_Hospitals,Department of Housing and Urban Development / Office of Housing-Federal Housing Commissioner,F - GUARANTEED/INSURED LOANS,8/13/2010 7:49,1/1/1965 0:00
14.129,"Mortgage Insurance_Nursing Homes, Intermediate Care Facilities, Board and Care Homes and Assisted Living Facilities",Department of Housing and Urban Development / Office of Housing-Federal Housing Commissioner,F - GUARANTEED/INSURED LOANS,8/13/2010 7:49,1/1/1965 0:00
14.151,Supplemental Loan Insurance_Multifamily Rental Housing,Department of Housing and Urban Development / Office of Housing-Federal Housing Commissioner,F - GUARANTEED/INSURED LOANS,8/16/2010 9:36,1/1/1969 0:00
14.218,Community Development Block Grants/Entitlement Grants,Department of Housing and Urban Development / Office of Community Planning and Development,A - Formula Grants,7/16/2010 8:01,1/1/1975 0:00
14.906,Healthy Homes Technical Studies Grants,Department of Housing and Urban Development / Office of Healthy Homes and Lead Hazard Control,B - Cooperative Agreements,9/19/2010 20:07,1/1/2004 0:00
15.025,"Services to Indian Children, Elderly and Families",Department of the Interior / Bureau of Indian Affairs,C - DIRECT PAYMENTS FOR A SPECIFIED USE,9/27/2010 8:48,1/1/1997 0:00
15.113,Indian Social Services_Welfare Assistance,Department of the Interior / Bureau of Indian Affairs,C - DIRECT PAYMENTS FOR A SPECIFIED USE,9/23/2010 7:52,1/1/1965 0:00
15.144,Indian Child Welfare Act_Title II Grants,Department of the Interior / Bureau of Indian Affairs,B - PROJECT GRANTS,12/2/2010 7:56,1/1/1980 0:00
15.616,Clean Vessel Act,Department of the Interior / Fish and Wildlife Service,B - PROJECT GRANTS,8/18/2010 7:52,1/1/1993 0:00
16.001,Law Enforcement Assistance_Narcotics and Dangerous Drugs_Laboratory Analysis,Department of Justice / Drug Enforcement Administration,J - PROVISION OF SPECIALIZED SERVICES,7/30/2009 11:35,1/1/1969 0:00
16.003,Law Enforcement Assistance_Narcotics and Dangerous Drugs Technical Laboratory Publications,Department of Justice / Drug Enforcement Administration,L - DISSEMINATION OF TECHNICAL INFORMATION,7/30/2009 11:35,1/1/1970 0:00
16.004,Law Enforcement Assistance_Narcotics and Dangerous Drugs Training,Department of Justice / Drug Enforcement Administration,M - TRAINING,7/30/2009 11:35,1/1/1969 0:00
16.527,"Supervised Visitation, Safe Havens for Children",Department of Justice / Violence Against Women Office,B - PROJECT GRANTS,11/17/2010 10:50,1/1/2002 0:00
16.528,Enhanced Training and Services to End Violence and Abuse of Women Later in Life,Department of Justice / Violence Against Women Office,B - PROJECT GRANTS,11/17/2010 10:51,1/1/2002 0:00
16.529,"Education, Training, and Enhanced Services to End Violence Against and Abuse of Women with Disabilities",Department of Justice / Violence Against Women Office,B - PROJECT GRANTS,11/17/2010 10:51,1/1/2002 0:00
16.544,Youth Gang Prevention,Department of Justice / Office of Juvenile Justice and Delinquency Prevention,B - PROJECT GRANTS,7/8/2010 7:39,1/1/1990 0:00
16.583,Children's Justice Act Partnerships for Indian Communities,Department of Justice / Office of Victims of Crime,"B - PROJECT GRANTS, C - DIRECT PAYMENTS FOR A SPECIFIED USE",7/8/2010 7:40,1/1/1989 0:00
16.589,"Rural Domestic Violence, Dating Violence, Sexual Assault, and Stalking Assistance Program",Department of Justice / Violence Against Women Office,B - PROJECT GRANTS,10/21/2010 13:11,1/1/1996 0:00
16.593,Residential Substance Abuse Treatment for State Prisoners,Department of Justice / Bureau of Justice Assistance,A - FORMULA GRANTS,6/21/2010 23:00,1/1/1996 0:00
16.616,Indian Country Alcohol and Drug Prevention,Department of Justice / Bureau of Justice Assistance,B - PROJECT GRANTS,7/9/2010 7:51,1/1/2001 0:00
16.801,Recovery Act - State Victim Assistance Formula Grant Program,Department of Justice / Office of Victims of Crime,B - Project Grants,7/8/2010 7:46,5/15/2009 17:33
16.802,Recovery Act - State Victim Compensation Formula Grant Program,Department of Justice,B - Project Grants,7/8/2010 7:46,5/15/2009 17:33
17.276,Health Coverage Tax Credit (HCTC),Department of Labor / Employment Training Administration,B - Project Grants,9/25/2010 8:55,5/22/2009 9:42
17.308,Farm Labor Contractor Registration,Department of Labor / Wage and Hour Division,"K - ADVISORY SERVICES AND COUNSELING, N - INVESTIGATION OF COMPLAINTS",8/27/2010 8:00,1/1/1972 0:00
17.502,Occupational Safety and Health_Susan Harwood Training Grants,Department of Labor / Occupational Safety and Health Administration,B - PROJECT GRANTS,7/9/2010 7:54,1/1/1991 0:00
17.503,Occupational Safety and Health_State Program,Department of Labor / Occupational Safety and Health Administration,B - PROJECT GRANTS,7/9/2010 7:54,1/1/1994 0:00
17.504,Consultation Agreements,Department of Labor / Occupational Safety and Health Administration,B - Cooperative Agreements,7/9/2010 7:55,1/1/1995 0:00
17.600,Mine Health and Safety Grants,Department of Labor / Mine Safety and Health Administration,B - PROJECT GRANTS,8/18/2010 11:01,1/1/1978 0:00
17.601,Mine Health and Safety Counseling and Technical Assistance,Department of Labor / Mine Safety and Health Administration,"K - ADVISORY SERVICES AND COUNSELING, L - DISSEMINATION OF TECHNICAL INFORMATION",8/18/2010 11:01,1/1/1978 0:00
17.602,Mine Health and Safety Education and Training,Department of Labor / Mine Safety and Health Administration,M - TRAINING,8/18/2010 11:00,1/1/1978 0:00
17.603,Brookwood-Sago Grant,Department of Labor / Mine Safety and Health Administration,B - PROJECT GRANTS,8/18/2010 11:02,1/1/2007 0:00
17.604,Safety and Health Grants,Department of Labor / Mine Safety and Health Administration,B - PROJECT GRANTS,8/18/2010 11:00,1/1/2008 0:00
19.019,International Programs to Combat Human Trafficking,U.S. Department of State / Trafficking in Persons,"B - Cooperative Agreements, B - Project Grants",11/5/2009 7:30,11/5/2009 7:30
19.021,Investing in People in The Middle East and North Africa,U.S. Department of State / Bureau of Near Eastern Affairs,B - Cooperative Agreements,7/9/2010 7:56,7/9/2010 7:56
19.124,U.S. Department of State,U.S. Department of State / Bureau of East Asian and  Pacific Affairs,"B - Cooperative Agreements, B - Cooperative Agreements (Discretionary Grants), B - Project Grants, B - Project Grants (for specified projects)",12/7/2010 10:06,12/7/2010 10:06
19.522,Overseas Refugee Assistance Programs for Strategic Global Priorities,"U.S. Department of State / Bureau of Population, Refugees, and Migration",B - Cooperative Agreements,10/16/2009 8:50,1/1/2005 0:00
20.700,Pipeline Safety Program Base Grants,Department of Transportation / Pipeline and Hazardous Materials Safety Administration,A - FORMULA GRANTS,8/3/2010 10:31,1/1/1971 0:00
20.721,PHMSA Pipeline Safety Program One Call Grant,Department of Transportation / Pipeline and Hazardous Materials Safety Administration,B - PROJECT GRANTS,8/4/2010 8:01,1/1/2008 0:00
21.011,Capital Magnet Fund,Department of the Treasury / Community Development Financial Institutions Fund,B - Project Grants,6/7/2010 8:18,2/5/2010 8:53
21.013,Qualifying Therapeutic Discovery Project Credit,Department of the Treasury / Internal Revenue Service (IRS),"B - Project Grants, B - Project Grants (Special)",7/22/2010 7:50,7/22/2010 7:50
43.010,Construction & Environmental Compliance & Remediation,National Aeronautics and Space Administration,"B - Cooperative Agreements, B - Cooperative Agreements (Discretionary Grants), B - Project Grants, B - Project Grants (Contracts), B - Project Grants (Cooperative Agreements or Contracts), B - Project Grants (Cooperative Agreements), B - Project Grants (Discretionary), B - Project Grants (Fellowships), B - Project Grants (for collaborative design of curriculum, production of, B - Project Grants (for specified projects), B - Project Grants (including individual awards), B - Project Grants (including travel grants)",11/1/2010 7:35,11/1/2010 7:35
45.310,Grants to States,Institute of Museum and Library Services,A - FORMULA GRANTS,11/7/2008 0:00,1/1/1998 0:00
45.312,National Leadership Grants,Institute of Museum and Library Services,B - PROJECT GRANTS,11/14/2008 0:00,1/1/1998 0:00
64.005,Grants to States for Construction of State Home Facilities,Department of Veterans Affairs / VA Health Administration Center,B - PROJECT GRANTS,10/19/2009 7:48,1/1/1970 0:00
64.007,Blind Rehabilitation Centers,Department of Veterans Affairs / VA Health Administration Center,J - PROVISION OF SPECIALIZED SERVICES,7/16/2008 0:00,1/1/1967 0:00
64.008,Veterans Domiciliary Care,Department of Veterans Affairs / VA Health Administration Center,J - PROVISION OF SPECIALIZED SERVICES,6/19/2008 0:00,1/1/1965 0:00
64.009,Veterans Medical Care Benefits,Department of Veterans Affairs / VA Health Administration Center,J - PROVISION OF SPECIALIZED SERVICES,6/16/2008 0:00,1/1/1965 0:00
64.010,Veterans Nursing Home Care,Department of Veterans Affairs / VA Health Administration Center,J - PROVISION OF SPECIALIZED SERVICES,6/16/2008 0:00,1/1/1967 0:00
64.011,Veterans Dental Care,Department of Veterans Affairs / VA Health Administration Center,J - PROVISION OF SPECIALIZED SERVICES,6/16/2008 0:00,1/1/1967 0:00
64.012,Veterans Prescription Service,Department of Veterans Affairs / VA Health Administration Center,"H - SALE, EXCHANGE, OR DONATION OF PROPERTY OR GOODS",6/19/2008 0:00,1/1/1967 0:00
64.013,Veterans Prosthetic Appliances,Department of Veterans Affairs / VA Health Administration Center,J - PROVISION OF SPECIALIZED SERVICES,6/19/2008 0:00,1/1/1967 0:00
64.014,Veterans State Domiciliary Care,Department of Veterans Affairs / VA Health Administration Center,A - FORMULA GRANTS,6/19/2008 0:00,1/1/1970 0:00
64.015,Veterans State Nursing Home Care,Department of Veterans Affairs / VA Health Administration Center,A - FORMULA GRANTS,6/19/2008 0:00,1/1/1970 0:00
64.016,Veterans State Hospital Care,Department of Veterans Affairs / VA Health Administration Center,A - FORMULA GRANTS,6/16/2008 0:00,1/1/1970 0:00
64.018,Sharing Specialized Medical Resources,Department of Veterans Affairs / VA Health Administration Center,J - PROVISION OF SPECIALIZED SERVICES,6/20/2008 0:00,1/1/1971 0:00
64.019,Veterans Rehabilitation_Alcohol and Drug Dependence,Department of Veterans Affairs / VA Health Administration Center,J - PROVISION OF SPECIALIZED SERVICES,7/16/2008 0:00,1/1/1971 0:00
64.022,Veterans Home Based Primary Care,Department of Veterans Affairs / VA Health Administration Center,J - PROVISION OF SPECIALIZED SERVICES,6/19/2008 0:00,1/1/1974 0:00
64.024,VA Homeless Providers Grant and Per Diem Program,Department of Veterans Affairs / VA Health Administration Center,B - PROJECT GRANTS,6/16/2008 0:00,1/1/1995 0:00
64.026,Veterans State Adult Day Health Care,Department of Veterans Affairs / National Cemetery System,B - PROJECT GRANTS,6/19/2008 0:00,1/1/2008 0:00
64.029,Purchase Care Program,Department of Veterans Affairs,C - Direct Payments for Specified Use,8/30/2010 12:57,8/30/2010 12:57
64.127,Monthly Allowance for Children of Vietnam Veterans Born with Spina Bifida,Department of Veterans Affairs / Veterans Benefits Administration,D - DIRECT PAYMENTS WITH UNRESTRICTED USE,7/16/2008 0:00,1/1/1997 0:00
64.128,Vocational Training and Rehabilitation for Vietnam Veterans' Children with Spina Bifida or Other Covered Birth Defects,Department of Veterans Affairs / Veterans Benefits Administration,C - DIRECT PAYMENTS FOR A SPECIFIED USE,6/20/2008 0:00,1/1/1997 0:00
66.418,Construction Grants for Wastewater Treatment Works,Environmental Protection Agency / Office of Water,B - PROJECT GRANTS,4/27/2010 7:37,1/1/1974 0:00
84.011,Migrant Education_State Grant Program,Department of Education / Office of Elementary and Secondary Education,A - FORMULA GRANTS,9/3/2010 19:05,1/1/1980 0:00
84.126,Rehabilitation Services_Vocational Rehabilitation Grants to States,Department of Education / Office of Special Education and Rehabilitative Services,A - FORMULA GRANTS,9/25/2010 8:58,1/1/1980 0:00
84.128,Rehabilitation Services_Service Projects,Department of Education / Office of Special Education and Rehabilitative Services,B - PROJECT GRANTS,9/25/2010 8:58,1/1/1980 0:00
84.129,Rehabilitation Long-Term Training,Department of Education / Office of Special Education and Rehabilitative Services,B - PROJECT GRANTS,9/25/2010 8:58,1/1/1980 0:00
84.133,National Institute on Disability and Rehabilitation Research,Department of Education / Office of Special Education and Rehabilitative Services,B - PROJECT GRANTS,9/25/2010 8:59,1/1/1980 0:00
84.380,Special Education -- Olympic Education Programs,Department of Education / Office of Special Education and Rehabilitative Services,B - PROJECT GRANTS,9/19/2010 20:23,1/1/2008 0:00
84.393,"Special Education - Grants for Infants and Families, Recovery Act",Department of Education / Office of Special Education and Rehabilitative Services,A - Formula Grants,9/29/2010 7:55,5/1/2009 16:59
84.398,"Independent Living State Grants, Recovery Act",Department of Education,A - Formula Grants,8/23/2010 10:29,5/1/2009 16:59
85.001,Harry S Truman Scholarship Program,Harry S Truman Scholarship Foundation,C - DIRECT PAYMENTS FOR A SPECIFIED USE,11/7/2008 0:00,1/1/1980 0:00
88.001,Architectural and Transportation Barriers Compliance Board,Architectural and Transportation Barriers Compliance Board,L - DISSEMINATION OF TECHNICAL INFORMATION,9/17/2008 0:00,1/1/1984 0:00
91.003,91.003 Annual Senior Fellowship Competition,United States Institute of Peace,B - Project Grants (Cooperative Agreements or Contracts),6/27/2010 8:22,6/27/2010 8:22
93.004,Cooperative Agreements to Improve the Health Status of Minority Populations,Department of Health and Human Services / Office of Minority Health,B - Cooperative Agreements,10/1/2010 8:21,1/1/1997 0:00
93.006,State and Territorial and Technical Assistance Capacity Development Minority HIV/AIDS Demonstration Program,Department of Health and Human Services / Office of Minority Health,B - PROJECT GRANTS,10/1/2010 8:21,1/1/2000 0:00
93.007,Public Awareness Campaigns on Embryo Adoption,Department of Health and Human Services / Office of the Secretary,B - PROJECT GRANTS,10/1/2010 8:21,1/1/2002 0:00
93.008,Medical Reserve Corps Small Grant Program,Department of Health and Human Services / Office of the Secretary,B - Cooperative Agreements,9/20/2010 10:24,1/1/2004 0:00
93.009,Compassion Capital Fund,Department of Health and Human Services / Administration for Children and Families,B - PROJECT GRANTS,7/18/2010 22:56,1/1/2004 0:00
93.010,Community-Based Abstinence Education (CBAE),Department of Health and Human Services / Administration for Children and Families,B - PROJECT GRANTS,7/6/2010 10:20,1/1/2005 0:00
93.011,National Organizations of State and Local Officials,Department of Health and Human Services / Health Resources and Services Administration,B - Cooperative Agreements,1/29/2011 21:08,1/29/2011 21:08
93.015,HIV Prevention Programs for Women,Department of Health and Human Services / Office of the Secretary,B - Cooperative Agreements,9/20/2010 10:25,1/1/2006 0:00
93.017,Strengthening the Management and Services of the Women's and Children's Hospitals in Kabul,Department of Health and Human Services / Office of the Secretary,B - PROJECT GRANTS,10/1/2010 12:29,1/1/2006 0:00
93.018,Strengthening Public Health Services at the Outreach Offices of the U.S.-Mexico Border Health Commission,Department of Health and Human Services / Office of the Secretary,B - PROJECT GRANTS,8/27/2010 8:09,1/1/2006 0:00
93.019,Technical Assistance and Provision for Foreign Hospitals and Health Organizations,Department of Health and Human Services / Office of the Secretary,B - PROJECT GRANTS,10/26/2010 10:14,1/1/2008 0:00
93.043,"Special Programs for the Aging_Title III, Part D_Disease Prevention and Health Promotion Services",Department of Health and Human Services / Administration on Aging,A - FORMULA GRANTS,8/16/2010 10:10,1/1/1992 0:00
93.044,"Special Programs for the Aging_Title III, Part B_Grants for Supportive Services and Senior Centers",Department of Health and Human Services / Administration on Aging,A - FORMULA GRANTS,7/6/2010 10:17,1/1/1992 0:00
93.045,"Special Programs for the Aging_Title III, Part C_Nutrition Services",Department of Health and Human Services / Administration on Aging,A - FORMULA GRANTS,8/5/2010 7:48,1/1/1992 0:00
93.047,"Special Programs for the Aging_Title VI, Part A, Grants to Indian Tribes_Part B, Grants to Native Hawaiians",Department of Health and Human Services / Administration on Aging,B - PROJECT GRANTS,8/5/2010 7:48,1/1/1992 0:00
93.051,Alzheimer's Disease Demonstration Grants to States,Department of Health and Human Services / Administration on Aging,B - PROJECT GRANTS,9/27/2010 9:13,1/1/1999 0:00
93.052,"National Family Caregiver Support, Title III, Part E",Department of Health and Human Services / Administration on Aging,A - FORMULA GRANTS,8/5/2010 7:48,1/1/2001 0:00
93.053,Nutrition Services Incentive Program,Department of Health and Human Services / Administration on Aging,A - FORMULA GRANTS,8/5/2010 7:49,1/1/2003 0:00
93.054,"National Family Caregiver Support, Title VI, Part C, Grants To Indian Tribes And Native Hawaiians",Department of Health and Human Services / Administration on Aging,B - PROJECT GRANTS,8/5/2010 7:49,1/1/2007 0:00
93.061,Innovations in Applied Public Health Research,Department of Health and Human Services / Centers for Disease Control and Prevention,"B - Cooperative Agreements, B - Project Grants",7/23/2010 7:58,1/1/2004 0:00
93.062,Biomonitoring Programs for State Public Health Laboratories,Department of Health and Human Services / Centers for Disease Control and Prevention,B - Cooperative Agreements,9/22/2010 7:27,9/14/2009 10:10
93.063,Centers for Genomics and Public Health,Department of Health and Human Services / Centers for Disease Control and Prevention,B - PROJECT GRANTS,8/30/2010 13:23,1/1/2004 0:00
93.064,"Laboratory Training, Evaluation, and Quality Assurance Programs",Department of Health and Human Services / Centers for Disease Control and Prevention,B - Cooperative Agreements,9/22/2010 7:28,1/1/2004 0:00
93.065,"Laboratory Leadership, Workforce Training and Management Development, Improving Public Health Laboratory Infrastructure",Department of Health and Human Services / Centers for Disease Control and Prevention,B - Cooperative Agreements,7/28/2010 7:51,1/1/2005 0:00
93.066,State Vital Statistics Improvement Program,Department of Health and Human Services / Centers for Disease Control and Prevention,B - Cooperative Agreements,7/23/2010 7:59,1/1/2004 0:00
93.067,Global AIDS,Department of Health and Human Services / Centers for Disease Control and Prevention,B - PROJECT GRANTS,8/28/2009 10:46,1/1/2005 0:00
93.068,"Chronic Diseases:  Research, Control, and Prevention",Department of Health and Human Services / Centers for Disease Control and Prevention,B - Cooperative Agreements,7/16/2010 8:06,1/1/2005 0:00
93.070,Environmental Public Health and Emergency Response,Department of Health and Human Services / Centers for Disease Control and Prevention,B - Cooperative Agreements,7/15/2010 7:41,9/23/2009 10:10
93.071,Medicare Enrollment Assistance Program,Department of Health and Human Services / Administration on Aging,"A - FORMULA GRANTS, B - PROJECT GRANTS",9/22/2010 7:28,1/1/2008 0:00
93.073,Birth Defects and Developmental Disabilities - Prevention and Surveillance,Department of Health and Human Services / Centers for Disease Control and Prevention,B - Cooperative Agreements,7/16/2010 8:07,2/16/2010 8:13
93.086,Healthy Marriage Promotion and Responsible Fatherhood Grants,Department of Health and Human Services / Administration for Children and Families,"B - PROJECT GRANTS, L - DISSEMINATION OF TECHNICAL INFORMATION",7/18/2010 22:56,1/1/2006 0:00
93.087,Enhance the Safety of Children Affected by Parental Methamphetamine or Other Substance Abuse,Department of Health and Human Services / Administration for Children and Families,B - PROJECT GRANTS,7/7/2010 7:34,1/1/2007 0:00
93.088,Advancing System Improvements to Support Targets for Healthy People 2010,Department of Health and Human Services / Office of the Secretary,B - PROJECT GRANTS,10/1/2010 8:22,1/1/2008 0:00
93.092,Personal Responsibility Education Program,Department of Health and Human Services / Administration for Children and Families,"A - Formula Grants, B - Project Grants",8/9/2010 8:05,5/10/2010 13:53
93.103,Food and Drug Administration_Research,Department of Health and Human Services / Food and Drug Administration,"B - Cooperative Agreements, B - Project Grants, B - Project Grants (for specified projects)",9/13/2010 12:03,1/1/1990 0:00
93.104,Comprehensive Community Mental Health Services for Children with Serious Emotional Disturbances (SED),Department of Health and Human Services / Substance Abuse and Mental Health Services Administration,B - PROJECT GRANTS,10/18/2010 11:27,1/1/1993 0:00
93.105,Bilingual/Bicultural Service Demonstration Grants,Department of Health and Human Services / Office of Minority Health,B - PROJECT GRANTS,10/1/2010 8:22,1/1/1993 0:00
93.107,Area Health Education Centers Point of Service Maintenance and Enhancement Awards,Department of Health and Human Services / Health Resources and Services Administration,B - Cooperative Agreements,7/2/2010 10:10,1/1/1993 0:00
93.110,Maternal and Child Health Federal Consolidated Programs,Department of Health and Human Services / Health Resources and Services Administration,B - PROJECT GRANTS,7/9/2010 8:03,1/1/1990 0:00
93.111,Adolescent Family Life Research Grants,Department of Health and Human Services / Office of Population Affairs,B - PROJECT GRANTS,9/29/2010 7:56,1/1/1990 0:00
93.113,Environmental Health,Department of Health and Human Services / National Institutes of Health,B - PROJECT GRANTS,7/6/2010 10:52,1/1/1990 0:00
93.116,Project Grants and Cooperative Agreements for Tuberculosis Control Programs,Department of Health and Human Services / Centers for Disease Control and Prevention,B - Cooperative Agreements,7/23/2010 8:00,1/1/1990 0:00
93.117,Preventive Medicine Residency Program,Department of Health and Human Services / Health Resources and Services Administration,"B - PROJECT GRANTS, M - Training",7/1/2010 14:50,1/1/1990 0:00
93.118,Acquired Immunodeficiency Syndrome (AIDS) Activity,Department of Health and Human Services / Centers for Disease Control and Prevention,B - PROJECT GRANTS,9/22/2010 7:28,1/1/1990 0:00
93.121,Oral Diseases and Disorders Research,Department of Health and Human Services / National Institutes of Health,B - PROJECT GRANTS,6/29/2010 7:56,1/1/1990 0:00
93.124,Nurse Anesthetist Traineeships,Department of Health and Human Services / Health Resources and Services Administration,A - FORMULA GRANTS,7/2/2010 10:15,1/1/1990 0:00
93.127,Emergency Medical Services for Children,Department of Health and Human Services / Health Resources and Services Administration,B - Cooperative Agreements,7/9/2010 8:04,1/1/1990 0:00
93.129,Technical and Non-Financial Assistance to Health Centers,Department of Health and Human Services / Health Resources and Services Administration,B - Cooperative Agreements,9/16/2010 11:08,1/1/1990 0:00
93.130,Cooperative Agreements to States/Territories for the Coordination and Development of Primary Care Offices,Department of Health and Human Services / Health Resources and Services Administration,B - Cooperative Agreements,7/1/2010 15:12,1/1/1990 0:00
93.134,Grants to Increase Organ Donations,Department of Health and Human Services / Health Resources and Services Administration,"B - Cooperative Agreements, B - Project Grants",9/16/2010 11:08,1/1/1990 0:00
