"#","Program Title","Agency/Office","Types of Assistance","Date Modified","Date Published"
"15.035","Forestry on Indian Lands","Department of the Interior / Bureau of Indian Affairs","C - DIRECT PAYMENTS FOR A SPECIFIED USE, J - PROVISION OF SPECIALIZED SERVICES, K - ADVISORY SERVICES AND COUNSELING",9/27/2010 8:55,1/1/1997 0:00
"15.233","Forests and Woodlands Resource Management","Department of the Interior / Bureau of Land Management","B - Cooperative Agreements (Discretionary Grants), K - ADVISORY SERVICES AND COUNSELING, M - TRAINING",9/17/2010 8:00,1/1/2008 0:00
"15.234","Secure Rural Schools and Community Self-Determination","Department of the Interior / Bureau of Land Management","B - Cooperative Agreements",9/19/2010 20:08,1/1/2008 0:00
"15.236","Environmental Quality and Protection Resource Management","Department of the Interior / Bureau of Land Management","B - Cooperative Agreements (Discretionary Grants), K - ADVISORY SERVICES AND COUNSELING, L - DISSEMINATION OF TECHNICAL INFORMATION, M - TRAINING",9/19/2010 20:09,1/1/2008 0:00
"15.237","Rangeland Resource Management","Department of the Interior / Bureau of Land Management","B - Cooperative Agreements, K - ADVISORY SERVICES AND COUNSELING, M - TRAINING",9/19/2010 20:10,1/1/2008 0:00
"15.238","Challenge Cost Share","Department of the Interior / Bureau of Land Management","B - Cooperative Agreements, I - USE OF PROPERTY, FACILITIES, OR EQUIPMENT, K - ADVISORY SERVICES AND COUNSELING, M - TRAINING",9/19/2010 20:10,1/1/2008 0:00
"15.518","Garrison Diversion Unit","Department of the Interior / Bureau of Reclamation","B - Project Grants (Cooperative Agreements or Contracts)",4/16/2011 5:00,1/1/2007 0:00
"15.520","Lewis and Clark Rural Water System","Department of the Interior / Bureau of Reclamation","B - Cooperative Agreements",4/16/2011 5:00,1/1/2007 0:00
"15.533","California Water Security and Environmental Enhancement","Department of the Interior / Bureau of Reclamation","B - Cooperative Agreements",4/16/2011 5:00,1/1/2007 0:00
"15.535","Upper Colorado River Basin Fish and Wildlife Mitigation Program.","Department of the Interior","B - Cooperative Agreements (Discretionary Grants)",4/16/2011 5:00,5/26/2009 15:39
"15.649","Service Training and Technical Assistance (Generic Training)","Department of the Interior / Fish and Wildlife Service","B - PROJECT GRANTS",8/19/2010 7:48,1/1/2007 0:00
"15.666","Endangered Species Conservation-Wolf Livestock Loss Compensation and Prevention","Department of the Interior / Fish and Wildlife Service","B - Project Grants",12/1/2010 10:44,12/1/2010 10:44
"15.921","Rivers, Trails and Conservation Assistance","Department of the Interior / National Park Service","K - ADVISORY SERVICES AND COUNSELING",11/10/2008 0:00,1/1/1994 0:00
"15.930","Chesapeake Bay Gateways Network","Department of the Interior / National Park Service","B - PROJECT GRANTS",11/5/2008 0:00,1/1/2007 0:00
"19.016","Iraq Assistance Programs","U.S. Department of State / Bureau of Near Eastern Affairs","B - Cooperative Agreements",7/22/2009 12:02,7/22/2009 12:02
"19.124","U.S. Department of State","U.S. Department of State / Bureau of East Asian and  Pacific Affairs","B - Cooperative Agreements, B - Cooperative Agreements (Discretionary Grants), B - Project Grants, B - Project Grants (for specified projects)",12/7/2010 10:06,12/7/2010 10:06
"78.004","Commodity Futures Reparations Claims","Commodity Futures Trading Commission","N - INVESTIGATION OF COMPLAINTS",9/17/2008 0:00,1/1/1977 0:00
"85.003","MCC Domestic Assistance for Overseas Programs","Millennium Challenge Corporation","B - Project Grants (Contracts), C - Direct Payments for Specified Use",6/18/2010 7:36,6/18/2010 7:36
"85.105","Agriscience Awards","Christopher Columbus Fellowship Foundation","C - Direct Payments for Specified Use, D - Direct Payments with Unrestricted Use",12/10/2010 7:56,2/19/2010 7:51
"93.570","Community Services Block Grant_Discretionary Awards","Department of Health and Human Services / Administration for Children and Families","B - PROJECT GRANTS",7/18/2010 23:02,1/1/1992 0:00
"98.009","John Ogonowski Farmer-to-Farmer Program","Agency for International Development","B - PROJECT GRANTS",9/23/2008 0:00,1/1/2004 0:00
